year,rank,title,author,price,rating,format
2018,2,"Girl, Wash Your Face: Stop Believing the Lies About Who You Are So You Can Become Who You Were Meant to Be",Rachel Hollis,$14.00,4.5,Hardcover
2018,3,The Wonky Donkey,Craig Smith,$5.28,4.8,Paperback
2018,4,Fire and Fury: Inside the Trump White House,Michael Wolff,$5.98,4.0,Hardcover
2018,5,Fear: Trump in the White House,Bob Woodward,$10.99,4.4,Hardcover
2018,6,Last Week Tonight with John Oliver Presents: A Day in the Life of Marlon Bundo (HBO),Jill Twiss,$4.48,4.9,Hardcover
2018,7,12 Rules for Life: An Antidote to Chaos,Jordan B. Peterson,$14.52,4.7,Hardcover
2018,8,Magnolia Table,Joanna Gaines,$20.95,4.8,Hardcover
2018,9,Whose Boat Is This Boat?: Comments That Don't Help in the Aftermath of a Hurricane,The Staff of The Late Show with Stephen Colbert,$9.94,4.6,Hardcover
2018,10,The Subtle Art of Not Giving a F*ck: A Counterintuitive Approach to Living a Good Life,Mark Manson,$12.75,4.5,Hardcover
2018,11,"A Higher Loyalty: Truth, Lies, and Leadership",James Comey,$15.00,4.6,Hardcover
2018,12,The Complete Ketogenic Diet for Beginners: Your Essential Guide to Living the Keto Lifestyle,Amy Ramos,$6.30,4.3,Paperback
2018,13,Diary of a Wimpy Kid #13: Meltdown,Jeff Kinney,$9.98,4.8,Hardcover
2018,14,The 5 Love Languages: The Secret to Love that Lasts,Gary Chapman,$8.37,4.8,Paperback
2018,15,First 100 Words: A padded board book,Roger Priddy,$3.88,4.7,Board book
2018,16,Dog Man: Lord of the Fleas: From the Creator of Captain Underpants (Dog Man #5),Dav Pilkey,$14.17,4.8,Hardcover
2018,17,Educated: A Memoir,Tara Westover,$11.98,4.6,Hardcover
2018,18,You Are a Badass: How to Stop Doubting Your Greatness and Start Living an Awesome Life,Jen Sincero,$7.96,4.7,Paperback
2018,19,"The Plant Paradox: The Hidden Dangers in ""Healthy"" Foods That Cause Disease and Weight Gain (The Plant Paradox, 1)",Dr. Steven R Gundry  MD,$15.65,4.4,Hardcover
2018,20,Giraffes Can't Dance,Giles Andreae,$6.50,4.8,Board book
2018,21,D&D 2014 Player's Handbook (Dungeons & Dragons Core Rulebook),Dungeons & Dragons,$44.72,4.9,Hardcover
2018,22,Homebody: A Guide to Creating Spaces You Never Want to Leave,Joanna Gaines,$23.98,4.8,Hardcover
2018,23,The Very Hungry Caterpillar,Eric Carle,$5.75,4.9,Board book
2018,24,Crazy Rich Asians (Crazy Rich Asians Trilogy),Kevin Kwan,$9.46,4.3,Paperback
2018,25,The Hate U Give: A Printz Honor Winner,Angie Thomas,$6.95,4.7,Hardcover
2018,26,The Instant Pot Electric Pressure Cooker Cookbook: Easy Recipes for Fast & Healthy Meals,Laurel Randolph,$7.85,4.4,Paperback
2018,27,The Four Agreements: A Practical Guide to Personal Freedom (A Toltec Wisdom Book),Don Miguel Ruiz,$7.05,4.7,Paperback
2018,28,The Wonderful Things You Will Be,Emily Winfield Martin,$10.71,4.9,Hardcover
2018,29,P is for Potty! (Sesame Street) (Lift-the-Flap),Naomi Kleinberg,$8.36,4.7,Board book
2018,30,The Pout-Pout Fish,Deborah Diesen,$4.79,4.8,Board book
2018,31,CreateSpace Classics Lettering and Modern Calligraphy: A Beginner's Guide: Learn Hand Lettering and Brush Lettering,Paper Peony Press,$6.99,4.5,Paperback
2018,32,Dear Zoo: A Lift-the-Flap Book,Rod Campbell,$5.00,4.8,Board book
2018,33,"Oh, the Places You'll Go!",Dr. Seuss,$8.48,4.9,Hardcover
2018,34,Dog Man and Cat Kid: From the Creator of Captain Underpants (Dog Man #4),Dav Pilkey,$1.52,4.8,Hardcover
2018,35,Goodnight Moon,Margaret Wise Brown,$6.48,4.9,Board book
2018,36,"Salt, Fat, Acid, Heat: Mastering the Elements of Good Cooking",Samin Nosrat,$18.72,4.8,Hardcover
2018,37,A Wrinkle in Time (Time Quintet),Madeleine L'Engle,$5.93,4.4,Paperback
2018,38,How to Win Friends & Influence People (Dale Carnegie Books),Dale Carnegie,$9.99,4.7,Paperback
2018,39,Dog Man: Brawl of the Wild: From the Creator of Captain Underpants (Dog Man #6),Dav Pilkey,$11.19,4.8,Hardcover
2018,40,Instant Pot Pressure Cooker Cookbook: 500 Everyday Recipes for Beginners and Advanced Users. Try Easy and Healthy Instant Pot Recipes.,Jennifer Smith,$10.47,4.4,Paperback
2018,41,Milk and Honey,Rupi Kaur,$7.83,4.7,Paperback
2018,42,Little Fires Everywhere: Reese's Book Club,Celeste Ng,$8.99,4.4,Hardcover
2018,43,Kitchen Confidential Updated Edition: Adventures in the Culinary Underbelly (P.S.),Anthony Bourdain,$10.49,4.8,Paperback
2018,44,The President Is Missing: A Novel,James Patterson,$15.32,4.3,Hardcover
2018,45,"School Zone Big Preschool Workbook: 320 Pages, Toddler, Pre-K, ABCs, Alphabet, Basic Phonics, Writing Skills, Early Math & Numbers, Colors & Shapes, Matching, Follow Directions, Ages 3-5",School Zone,$11.76,4.8,Paperback
2018,46,"The Plant Paradox Cookbook: 100 Delicious Recipes to Help You Lose Weight, Heal Your Gut, and Live Lectin-Free (The Plant Paradox, 2)",Dr. Steven R Gundry  MD,$7.65,4.4,Hardcover
2018,47,Ready Player One: A Novel,Ernest Cline,$9.97,4.6,Paperback
2018,48,Fahrenheit 451,Ray Bradbury,$9.05,4.6,Paperback
2018,49,Ship of Fools: How a Selfish Ruling Class Is Bringing America to the Brink of Revolution,Tucker Carlson,$8.78,4.7,Hardcover
2018,50,The Alchemist: A Modern Classic of Magic and Mysticism (Perennial Classics),Paulo Coelho,$10.19,4.6,Paperback
2018,51,Wonder,R. J. Palacio,$9.54,4.8,Hardcover
2018,52,To Kill a Mockingbird,Harper Lee,$10.00,4.7,Paperback
2018,53,The Whole30: The 30-Day Guide to Total Health and Food Freedom,Melissa Hartwig Urban,$8.49,4.6,Hardcover
2018,54,The Keto Diet: The Complete Guide to a High-Fat Diet,Leanne Vogel,$15.65,4.4,Paperback
2018,55,"Everybody, Always: Becoming Love in a World Full of Setbacks and Difficult People",Bob Goff,$8.95,4.8,Paperback
2018,56,Before We Were Yours: A Novel,Lisa Wingate,$9.49,4.6,Hardcover
2018,57,The Reckoning: A Novel,John Grisham,$12.98,4.2,Hardcover
2018,58,"Brown Bear, Brown Bear, What Do You See?",Bill Martin Jr.,$5.36,4.9,Board book
2018,59,Beneath a Scarlet Sky: A Novel,Mark Sullivan,$13.90,4.6,Paperback
2018,60,What to Expect When You're Expecting: (Updated in 2024),Heidi Murkoff,$10.73,4.8,Paperback
2018,61,Principles: Life and Work,Ray Dalio,$15.50,4.6,Hardcover
2018,62,Astrophysics for People in a Hurry,Neil deGrasse Tyson,$10.79,4.6,Hardcover
2018,63,Laugh-Out-Loud Jokes for Kids,Rob Elliott,$4.64,4.6,Paperback
2018,64,"Medical Medium Liver Rescue: Answers to Eczema, Psoriasis, Diabetes, Strep, Acne, Gout, Bloating, Gallstones, Adrenal Stress, Fatigue, Fatty Liver, Weight Issues, SIBO & Autoimmune Disease",Anthony William,$19.29,4.7,Hardcover
2018,65,The Official SAT Study Guide,The College Board,$2.94,4.5,Paperback
2018,66,Calm the F*ck Down: An Irreverent Adult Coloring Book,Sasha O'Hara,$6.99,4.6,Paperback
2018,67,"The Care and Keeping of You: The Body Book for Younger Girls, Revised Edition (American Girl® Wellbeing)",Valorie Schaefer,$19.37,4.8,Paperback
2018,68,The Outsider: A Novel,Stephen King,$15.30,4.5,Hardcover
2018,69,Where the Crawdads Sing: Reese's Book Club,Delia Owens,$14.00,4.7,Hardcover
2018,70,N/A,N/A,$45.76,4.9,N/A
2018,71,Sapiens: A Brief History of Humankind,Yuval Noah Harari,$6.91,4.6,Paperback
2018,72,Love You Forever,Robert Munsch,$4.98,4.9,Paperback
2018,73,Dragons Love Tacos,Adam Rubin,$9.95,4.8,Hardcover
2018,74,The Woman in the Window: A Novel,A. J. Finn,$10.19,4.3,Hardcover
2018,75,N/A,N/A,$49.95,4.9,N/A
2018,76,Simply Keto: A Practical Approach to Health & Weight Loss with 100+ Easy Low-Carb Recipes,Suzanne Ryan,$17.99,4.6,Paperback
2018,77,StrengthsFinder 2.0,Gallup,$23.99,4.1,Hardcover
2018,78,"Extreme Ownership: How U.S. Navy SEALs Lead and Win (New Edition) (Extreme Ownership Trilogy, 1)",Jocko Willink,$12.04,4.8,Hardcover
2018,79,The Russia Hoax: The Illicit Scheme to Clear Hillary Clinton and Frame Donald Trump,Gregg Jarrett,$8.53,4.8,Hardcover
2018,80,How to Draw 101 Animals,Barry Green,$3.60,4.7,Paperback
2018,81,The Sun and Her Flowers,Rupi Kaur,$7.78,4.7,Paperback
2018,82,The Life-Changing Magic of Tidying Up: The Japanese Art of Decluttering and Organizing,Marie Kondō,$7.72,4.5,Hardcover
2018,83,"The Easy 5-Ingredient Ketogenic Diet Cookbook: Low-Carb, High-Fat Recipes for Busy People on the Keto Diet",Jen Fisch,$8.32,4.4,Paperback
2018,84,Where Do Diggers Sleep at Night? (Where Do...Series),Brianna Caplan Sayres,$7.18,4.8,Board book
2018,85,The 7 Habits of Highly Effective People: Powerful Lessons in Personal Change,Stephen R. Covey,$16.63,4.7,Paperback
2018,86,"Whiskey in a Teacup: What Growing Up in the South Taught Me About Life, Love, and Baking Biscuits",Reese Witherspoon,$10.90,4.7,Hardcover
2018,87,Man's Search for Meaning (OLD EDITION/OUT OF PRINT),Viktor E. Frankl,$1.82,4.7,Paperback
2018,88,The Great Alone: A Novel,Kristin Hannah,$15.83,4.6,Hardcover
2018,89,The Total Money Makeover: Classic Edition: A Proven Plan for Financial Fitness,Dave Ramsey,$14.50,4.7,Hardcover
2018,90,Cravings: Hungry for More: A Cookbook,Chrissy Teigen,$8.10,4.8,Hardcover
2018,91,The Handmaid's Tale,Margaret Atwood,$8.95,4.3,Paperback
2018,92,The Gifts of Imperfection: Let Go of Who You Think You're Supposed to Be and Embrace Who You Are,Brené Brown,$12.04,4.7,Paperback
2018,93,The Great Gatsby: The Only Authorized Edition,F. Scott Fitzgerald,$8.39,4.4,Paperback
2018,94,"The Body Keeps the Score: Brain, Mind, and Body in the Healing of Trauma",Bessel van der Kolk M.D.,$10.86,4.8,Paperback
2018,95,"Gmorning, Gnight!: Little Pep Talks for Me & You",Lin-Manuel Miranda,$10.94,4.8,Hardcover
2018,96,Rich Dad Poor Dad: What the Rich Teach Their Kids About Money That the Poor and Middle Class Do Not!,Robert T. Kiyosaki,$9.99,4.7,Mass Market Paperback
2018,97,Make Your Bed: Little Things That Can Change Your Life...And Maybe the World,Admiral William H. McRaven,$11.43,4.7,Hardcover
2018,98,Harry Potter Paperback Box Set (Books 1-7),J. K. Rowling,$52.62,4.9,Paperback
2018,99,N/A,N/A,$49.95,4.9,N/A
2019,1,Where the Crawdads Sing: Reese's Book Club,Delia Owens,$14.00,4.7,Hardcover
2019,2,Becoming,Michelle Obama,$5.29,4.8,Hardcover
2019,3,Educated: A Memoir,Tara Westover,$11.98,4.6,Hardcover
2019,4,Dog Man: For Whom the Ball Rolls: From the Creator of Captain Underpants (Dog Man #7),Dav Pilkey,$7.74,4.9,Hardcover
2019,5,"Girl, Wash Your Face: Stop Believing the Lies About Who You Are So You Can Become Who You Were Meant to Be",Rachel Hollis,$14.00,4.5,Hardcover
2019,6,Dog Man: Fetch-22: A Graphic Novel (Dog Man #8): From the Creator of Captain Underpants,Dav Pilkey,$8.27,4.9,Hardcover
2019,7,Wrecking Ball (Diary of a Wimpy Kid #14) (Volume 14),Jeff Kinney,$5.99,4.9,Hardcover
2019,8,The Wonderful Things You Will Be,Emily Winfield Martin,$10.71,4.9,Hardcover
2019,9,"School Zone Big Preschool Workbook: 320 Pages, Toddler, Pre-K, ABCs, Alphabet, Basic Phonics, Writing Skills, Early Math & Numbers, Colors & Shapes, Matching, Follow Directions, Ages 3-5",School Zone,$11.76,4.8,Paperback
2019,10,The 5 Love Languages: The Secret to Love that Lasts,Gary Chapman,$8.37,4.8,Paperback
2019,11,N/A,N/A,$7.78,4.6,N/A
2019,12,The Wonky Donkey,Craig Smith,$5.28,4.8,Paperback
2019,13,The Subtle Art of Not Giving a F*ck: A Counterintuitive Approach to Living a Good Life,Mark Manson,$12.75,4.5,Hardcover
2019,14,Difficult Riddles For Smart Kids: 300 Difficult Riddles And Brain Teasers Families Will Love (Thinking Books for Kids),M Prefontaine,$7.99,4.6,Paperback
2019,15,"Salt, Fat, Acid, Heat: Mastering the Elements of Good Cooking",Samin Nosrat,$18.72,4.8,Hardcover
2019,16,The Very Hungry Caterpillar,Eric Carle,$5.75,4.9,Board book
2019,17,What Should Danny Do? (The Power to Choose Series),Adir Levy,$11.96,4.8,Hardcover
2019,18,It's Not Supposed to Be This Way: Finding Unexpected Strength When Disappointments Leave You Shattered,Lysa TerKeurst,$11.00,4.8,Hardcover
2019,19,Hopscotch Girls I Am Confident Brave & Beautiful Inspirational Coloring Books for Kids Ages 4-8 & Up 8-12 Empowering Boost Confidence Color Book,Hopscotch Girls,$6.99,4.8,Paperback
2019,20,The Four Agreements: A Practical Guide to Personal Freedom (A Toltec Wisdom Book),Don Miguel Ruiz,$7.05,4.7,Paperback
2019,21,Unfreedom of the Press,Mark R. Levin,$7.97,4.8,Hardcover
2019,22,Dog Man: Brawl of the Wild: From the Creator of Captain Underpants (Dog Man #6),Dav Pilkey,$11.19,4.8,Hardcover
2019,23,Giraffes Can't Dance,Giles Andreae,$6.50,4.8,Board book
2019,24,If Animals Kissed Good Night,Ann Whitford Paul,$4.23,4.8,Board book
2019,25,"Oh, the Places You'll Go!",Dr. Seuss,$8.48,4.9,Hardcover
2019,26,Howard Stern Comes Again,Howard Stern,$13.90,4.5,Hardcover
2019,27,Guts: A Graphic Novel,Raina Telgemeier,$7.00,4.8,Paperback
2019,28,The Life-Changing Magic of Tidying Up: The Japanese Art of Decluttering and Organizing,Marie Kondō,$7.72,4.5,Hardcover
2019,29,"Harry Potter and the Goblet of Fire: The Illustrated Edition (Harry Potter, Book 4) (4)",J. K. Rowling,$27.92,4.9,Hardcover
2019,30,National Geographic Little Kids First Big Book of Why (National Geographic Little Kids First Big Books),Amy Shields,$10.61,4.8,Hardcover
2019,31,Instant Pot Pressure Cooker Cookbook: 500 Everyday Recipes for Beginners and Advanced Users. Try Easy and Healthy Instant Pot Recipes.,Jennifer Smith,$10.47,4.4,Paperback
2019,32,"The Body Keeps the Score: Brain, Mind, and Body in the Healing of Trauma",Bessel van der Kolk M.D.,$10.86,4.8,Paperback
2019,33,Good Days Start With Gratitude: A 52 Week Guide To Cultivate An Attitude Of Gratitude: Gratitude Journal,Pretty Simple Press,$1.59,4.6,Paperback
2019,34,Goodnight Moon,Margaret Wise Brown,$6.48,4.9,Board book
2019,35,The Complete Ketogenic Diet for Beginners: Your Essential Guide to Living the Keto Lifestyle,Amy Ramos,$6.30,4.3,Paperback
2019,36,Unicorn Coloring Book: For Kids Ages 4-8 (Silly Bear Coloring Books),Silly Bear,$7.49,4.8,Paperback
2019,37,Strange Planet (Strange Planet Series),Nathan W. Pyle,$6.54,4.9,Hardcover
2019,38,D&D 2014 Player's Handbook (Dungeons & Dragons Core Rulebook),Dungeons & Dragons,$44.72,4.9,Hardcover
2019,39,The Silent Patient,Alex Michaelides,$12.67,4.4,Hardcover
2019,40,"5,000 Awesome Facts (About Everything!) (National Geographic Kids)",National Geographic Kids,$2.54,4.8,Hardcover
2019,41,To Kill a Mockingbird,Harper Lee,$10.00,4.7,Paperback
2019,42,You Are a Badass: How to Stop Doubting Your Greatness and Start Living an Awesome Life,Jen Sincero,$7.96,4.7,Paperback
2019,43,"National Geographic Kids Why?: Over 1,111 Answers to Everything",Crispin Boyer,$12.77,4.8,Hardcover
2019,44,Can't Hurt Me: Master Your Mind and Defy the Odds,David Goggins,$28.97,4.8,Hardcover
2019,45,The Guardians: A Novel,John Grisham,$13.96,4.5,Hardcover
2019,46,P is for Potty! (Sesame Street) (Lift-the-Flap),Naomi Kleinberg,$8.36,4.7,Board book
2019,47,The Total Money Makeover: Classic Edition: A Proven Plan for Financial Fitness,Dave Ramsey,$14.50,4.7,Hardcover
2019,48,"Brown Bear, Brown Bear, What Do You See?",Bill Martin Jr.,$5.36,4.9,Board book
2019,49,The Unofficial Harry Potter Cookbook: From Cauldron Cakes to Knickerbocker Glory--More Than 150 Magical Recipes for Wizards and Non-Wizards Alike (Unofficial Cookbook Gift Series),Dinah Bucholz,$13.98,4.7,Hardcover
2019,50,The Mueller Report,The Washington Post,$7.98,4.5,Paperback
2019,51,Zen as F*ck: A Journal for Practicing the Mindful Art of Not Giving a Sh*t (Zen as F*ck Journals),Monica Sweeney,$6.90,4.7,Paperback
2019,52,Rich Dad Poor Dad: What the Rich Teach Their Kids About Money That the Poor and Middle Class Do Not!,Robert T. Kiyosaki,$9.99,4.7,Mass Market Paperback
2019,53,The Institute: A Novel,Stephen King,$9.03,4.6,Hardcover
2019,54,The Testaments: The Sequel to The Handmaid's Tale,Margaret Atwood,$15.68,4.6,Hardcover
2019,55,Super Deluxe Essential Handbook (Pokémon): The Need-to-Know Stats and Facts on Over 800 Characters,Scholastic,$29.53,4.8,Paperback
2019,56,CreateSpace Classics Lettering and Modern Calligraphy: A Beginner's Guide: Learn Hand Lettering and Brush Lettering,Paper Peony Press,$6.99,4.5,Paperback
2019,57,"Carson Dellosa 54 Phonics Flash Cards, Sight Words Flashcards for Kids Ages 4 and Up, High Frequency Vocabulary Preschool and Kindergarten Learning Activities, Toddler Stocking Stuffers",Brighter Child,$2.99,4.8,Cards
2019,58,Atomic Habits: An Easy & Proven Way to Build Good Habits & Break Bad Ones,James Clear,$13.10,4.8,Hardcover
2019,59,Make Your Bed: Little Things That Can Change Your Life...And Maybe the World,Admiral William H. McRaven,$11.43,4.7,Hardcover
2019,60,The Gifts of Imperfection: Let Go of Who You Think You're Supposed to Be and Embrace Who You Are,Brené Brown,$12.04,4.7,Paperback
2019,61,Sapiens: A Brief History of Humankind,Yuval Noah Harari,$6.91,4.6,Paperback
2019,62,What to Expect When You're Expecting: (Updated in 2024),Heidi Murkoff,$10.73,4.8,Paperback
2019,63,Where the Crawdads Sing: Reese's Book Club (A Novel),Delia Owens,$12.89,4.7,Paperback
2019,64,"Daring Greatly: How the Courage to Be Vulnerable Transforms the Way We Live, Love, Parent, and Lead",Brené Brown,$9.12,4.7,Paperback
2019,65,The Alchemist: A Modern Classic of Magic and Mysticism (Perennial Classics),Paulo Coelho,$10.19,4.6,Paperback
2019,66,The Pout-Pout Fish,Deborah Diesen,$4.79,4.8,Board book
2019,67,Talking to Strangers: What We Should Know about the People We Don't Know,Malcolm Gladwell,$11.50,4.4,Hardcover
2019,68,Dear Zoo: A Lift-the-Flap Book,Rod Campbell,$5.00,4.8,Board book
2019,69,The Overstory: A Novel,Richard Powers,$14.44,4.4,Paperback
2019,70,Fahrenheit 451,Ray Bradbury,$9.05,4.6,Paperback
2019,71,StrengthsFinder 2.0,Gallup,$23.99,4.1,Hardcover
2019,72,12 Rules for Life: An Antidote to Chaos,Jordan B. Peterson,$14.52,4.7,Hardcover
2019,73,Eleanor Oliphant Is Completely Fine: Reese's Book Club: A Novel,Gail Honeyman,$9.90,4.5,Paperback
2019,74,Me: Elton John Official Autobiography,Elton John,$9.95,4.7,Hardcover
2019,75,The Road Back to You: An Enneagram Journey to Self-Discovery,Ian Morgan Cron,$9.21,4.7,Hardcover
2019,76,The Tattooist of Auschwitz: A Novel,Heather Morris,$8.92,4.6,Paperback
2019,77,People of Walmart Adult Coloring Book: Rolling Back Dignity (OFFICIAL People of Walmart Books),Andrew Kipple,$11.99,4.7,Paperback
2019,78,The Great Gatsby: The Only Authorized Edition,F. Scott Fitzgerald,$8.39,4.4,Paperback
2019,79,The Complete Cookbook for Young Chefs: 100+ Recipes that You'll Love to Cook and Eat,America’s Test Kitchen Kids,$10.70,4.8,Hardcover
2019,80,"Blowout: Corrupted Democracy, Rogue State Russia, and the Richest, Most Destructive Industry on Earth",Rachel Maddow,$16.85,4.8,Hardcover
2019,81,Love You Forever,Robert Munsch,$4.98,4.9,Paperback
2019,82,"The Easy 5-Ingredient Ketogenic Diet Cookbook: Low-Carb, High-Fat Recipes for Busy People on the Keto Diet",Jen Fisch,$8.32,4.4,Paperback
2019,83,The Giving Tree,Shel Silverstein,$8.17,4.8,Hardcover
2019,84,Dragons Love Tacos,Adam Rubin,$9.95,4.8,Hardcover
2019,85,How to Win Friends & Influence People (Dale Carnegie Books),Dale Carnegie,$9.99,4.7,Paperback
2019,86,Magnolia Table,Joanna Gaines,$20.95,4.8,Hardcover
2019,87,"The Obesity Code: Unlocking the Secrets of Weight Loss (Why Intermittent Fasting Is the Key to Controlling Your Weight) (The Code Series, 1) (Book 1)",Dr. Jason Fung,$9.74,4.6,Paperback
2019,88,"Magic Tree House Boxed Set, Books 1-4: Dinosaurs Before Dark, The Knight at Dawn, Mummies in the Morning, and Pirates Past Noon",Mary Pope Osborne,$12.24,4.8,Paperback
2019,89,Then She Was Gone: A Novel,Lisa Jewell,$8.81,4.5,Paperback
2019,90,The Pioneers: The Heroic Story of the Settlers Who Brought the American Ideal West,David McCullough,$14.14,4.4,Hardcover
2019,91,Wacky Waving Inflatable Tube Guy: (The Original) (RP Minis),Conor Riordan,$11.66,4.0,Paperback
2019,92,"Medical Medium Liver Rescue: Answers to Eczema, Psoriasis, Diabetes, Strep, Acne, Gout, Bloating, Gallstones, Adrenal Stress, Fatigue, Fatty Liver, Weight Issues, SIBO & Autoimmune Disease",Anthony William,$19.29,4.7,Hardcover
2019,93,"The Care and Keeping of You: The Body Book for Younger Girls, Revised Edition (American Girl® Wellbeing)",Valorie Schaefer,$19.37,4.8,Paperback
2019,94,There's No Place Like Space! All About Our Solar System (The Cat in the Hat's Learning Library),Tish Rabe,$5.98,4.8,Hardcover
2019,95,How to Draw 101 Animals,Barry Green,$3.60,4.7,Paperback
2019,96,Simply Keto: A Practical Approach to Health & Weight Loss with 100+ Easy Low-Carb Recipes,Suzanne Ryan,$17.99,4.6,Paperback
2019,97,The Outsiders,S. E. Hinton,$9.74,4.7,Paperback
2019,98,The Try Not to Laugh Challenge - Would Your Rather? - EWW Edition,Crazy Corey,$6.99,4.6,Paperback
2020,1,A Promised Land,Barack Obama,$15.29,4.9,Hardcover
2020,2,Too Much and Never Enough: How My Family Created the World's Most Dangerous Man,Mary L. Trump Ph.D.,$9.98,4.6,Hardcover
2020,3,Where the Crawdads Sing: Reese's Book Club,Delia Owens,$14.00,4.7,Hardcover
2020,4,"My First Learn-to-Write Workbook: Practice for Kids with Pen Control, Line Tracing, Letters, and More!",Crystal Radke,$5.26,4.8,Paperback
2020,5,Midnight Sun,Stephenie Meyer,$20.43,4.8,Hardcover
2020,6,Untamed: Reese's Book Club,Glennon Doyle,$11.99,4.6,Hardcover
2020,7,If Animals Kissed Good Night,Ann Whitford Paul,$4.23,4.8,Board book
2020,8,White Fragility: Why It's So Hard for White People to Talk About Racism,Dr. Robin DiAngelo,$6.50,4.5,Paperback
2020,9,"School Zone Big Preschool Workbook: 320 Pages, Toddler, Pre-K, ABCs, Alphabet, Basic Phonics, Writing Skills, Early Math & Numbers, Colors & Shapes, Matching, Follow Directions, Ages 3-5",School Zone,$11.76,4.8,Paperback
2020,10,The Room Where It Happened: A White House Memoir,John Bolton,$12.13,4.2,Hardcover
2020,11,The Ballad of Songbirds and Snakes (A Hunger Games Novel) (The Hunger Games),Suzanne Collins,$26.03,4.6,Hardcover
2020,12,Dog Man: Grime and Punishment: A Graphic Novel (Dog Man #9): From the Creator of Captain Underpants (9),Dav Pilkey,$7.37,4.9,Hardcover
2020,13,The Very Hungry Caterpillar,Eric Carle,$5.75,4.9,Board book
2020,14,Becoming,Michelle Obama,$5.29,4.8,Hardcover
2020,15,How to Be an Antiracist,Ibram X. Kendi,$6.75,4.7,Hardcover
2020,16,The Four Agreements: A Practical Guide to Personal Freedom (A Toltec Wisdom Book),Don Miguel Ruiz,$7.05,4.7,Paperback
2020,17,Rage,Bob Woodward,$11.82,4.6,Hardcover
2020,18,Caste: The Origins of Our Discontents,Isabel Wilkerson,$8.42,4.8,Hardcover
2020,19,Greenlights,Matthew McConaughey,$9.00,4.6,Hardcover
2020,20,Hopscotch Girls I Am Confident Brave & Beautiful Inspirational Coloring Books for Kids Ages 4-8 & Up 8-12 Empowering Boost Confidence Color Book,Hopscotch Girls,$6.99,4.8,Paperback
2020,21,American Dirt (Oprah's Book Club): A Novel,Jeanine Cummins,$8.99,4.6,Hardcover
2020,22,"The Boy, the Mole, the Fox and the Horse: Inspiring Conversations on Hope, Love and Personal Growth",Charlie Mackesy,$11.57,4.8,Hardcover
2020,23,Little Fires Everywhere: A Novel,Celeste Ng,$9.35,4.4,Paperback
2020,24,The Deep End (Diary of a Wimpy Kid #15) (Volume 15),Jeff Kinney,$7.86,4.8,Hardcover
2020,25,Atomic Habits: An Easy & Proven Way to Build Good Habits & Break Bad Ones,James Clear,$13.10,4.8,Hardcover
2020,26,I Love You to the Moon and Back,Amelia Hepworth,$4.42,4.9,Board book
2020,27,How to Catch a Mermaid,Adam Wallace,$6.25,4.8,Hardcover
2020,28,"The Splendid and the Vile: A Saga of Churchill, Family, and Defiance During the Blitz",Erik Larson,$8.91,4.7,Hardcover
2020,29,How to Catch a Unicorn,Adam Wallace,$5.96,4.8,Hardcover
2020,30,Giraffes Can't Dance,Giles Andreae,$6.50,4.8,Board book
2020,31,"Brown Bear, Brown Bear, What Do You See?",Bill Martin Jr.,$5.36,4.9,Board book
2020,32,The 5 Love Languages: The Secret to Love that Lasts,Gary Chapman,$8.37,4.8,Paperback
2020,33,"Magnolia Table, Volume 2: A Collection of Recipes for Gathering",Joanna Gaines,$19.25,4.9,Hardcover
2020,34,The Vanishing Half: A GMA Book Club Pick (A Novel),Brit Bennett,$10.49,4.4,Hardcover
2020,35,Modern Comfort Food: A Barefoot Contessa Cookbook,Ina Garten,$16.30,4.8,Hardcover
2020,36,"Prayer Journal for Women: 52 Week Scripture, Devotional & Guided Prayer Journal",Shannon Roberts,$9.95,4.8,Paperback
2020,37,The Wonky Donkey,Craig Smith,$5.28,4.8,Paperback
2020,38,"The Body Keeps the Score: Brain, Mind, and Body in the Healing of Trauma",Bessel van der Kolk M.D.,$10.86,4.8,Paperback
2020,39,Paint by Sticker Kids: Zoo Animals: Create 10 Pictures One Sticker at a Time!,Workman Publishing,$6.99,4.8,Paperback
2020,40,Paint by Sticker Kids: Unicorns & Magic: Create 10 Pictures One Sticker at a Time! Includes Glitter Stickers,Workman Publishing,$8.94,4.8,Paperback
2020,41,What Should Danny Do? (The Power to Choose Series),Adir Levy,$11.96,4.8,Hardcover
2020,42,Wacky Waving Inflatable Tube Guy: (The Original) (RP Minis),Conor Riordan,$11.66,4.0,Paperback
2020,43,The Silent Patient,Alex Michaelides,$12.67,4.4,Hardcover
2020,44,The Big Book of Silly Jokes for Kids,Carole P. Roman,$5.99,4.7,Paperback
2020,45,Chicka Chicka Boom Boom (Board Book),Bill Martin Jr.,$4.30,4.9,Board book
2020,46,Live Free Or Die: America (and the World) on the Brink,Sean Hannity,$8.73,4.8,Hardcover
2020,47,Burn After Writing,Sharon Jones,$7.52,4.6,Paperback
2020,48,Get Out of Your Head: Stopping the Spiral of Toxic Thoughts,Jennie Allen,$6.04,4.7,Hardcover
2020,49,Human Body Activity Book for Kids: Hands-On Fun for Grades K-3,"Ph.D., Katie Stokes, M.Ed.,",$4.99,4.7,Paperback
2020,50,Educated: A Memoir,Tara Westover,$11.98,4.6,Hardcover
2020,51,Then She Was Gone: A Novel,Lisa Jewell,$8.81,4.5,Paperback
2020,52,Difficult Riddles For Smart Kids: 300 Difficult Riddles And Brain Teasers Families Will Love (Thinking Books for Kids),M Prefontaine,$7.99,4.6,Paperback
2020,53,1984: 75th Anniversary,George Orwell,$9.65,4.6,Mass Market Paperback
2020,54,Humans,Brandon Stanton,$16.71,4.9,Hardcover
2020,55,Goodnight Moon,Margaret Wise Brown,$6.48,4.9,Board book
2020,56,I've Loved You Since Forever,Hoda Kotb,$10.44,4.8,Hardcover
2020,57,Just Mercy: A Story of Justice and Redemption (One World Essentials),Bryan Stevenson,$10.93,4.8,Paperback
