year,rank,title,author,price,rating,format
2000,57,The Perfect Storm: A True Story of Men Against the Sea,Sebastian Junger,$10.90,4.6,Mass Market Paperback
2000,58,Designing Web Usability,Jakob Nielsen,$16.00,4.4,Paperback
2000,59,Sugar Busters! Cut Sugar to Trim Fat,H. Leighton Steward,$5.92,4.4,Hardcover
2000,60,"Oh, the Places You'll Go!",Dr. Seuss,$8.48,4.9,Hardcover
2000,61,Me Talk Pretty One Day,David Sedaris,$14.07,4.3,Hardcover
2000,62,Built to Last: Successful Habits of Visionary Companies,James C. Collins,$4.14,4.6,Paperback
2000,63,Gung Ho! Turn On the People in Any Organization,Ken Blanchard,$6.75,4.7,Hardcover
2000,64,Getting to Yes: Negotiating Agreement Without Giving In,Roger Fisher,$16.00,4.5,Paperback
2000,65,Dr. Atkins' New Diet Revolution,Robert C. Atkins,$0.55,4.4,Mass Market Paperback
2000,66,"The Lion's Game (A John Corey Novel, 2)",Nelson DeMille,$5.42,4.5,Hardcover
2000,67,Net Ready,Amir Hartman,$6.31,4.1,Hardcover
2000,68,Dr. Atkins' New Diet Revolution,Robert C. Atkins,$9.14,4.4,Paperback
2000,69,"Winter's Heart (The Wheel of Time, Book 9) (Wheel of Time, 9)",Robert Jordan,$23.00,4.6,Hardcover
2000,70,Left Behind: A Novel of the Earth's Last Days (Left Behind No. 1),Tim LaHaye,$9.39,4.6,Paperback
2000,71,Newton's Telecom Dictionary: The Official Dictionary of Telecommunications Networking and Internet,Harry Newton,$15.94,4.8,Paperback
2000,72,The Goal: A Process of Ongoing Improvement,Eliyahu M. Goldratt,$14.76,4.6,Paperback
2000,73,Six Sigma: The Breakthrough Management Strategy Revolutionizing the World's Top Corporations,Mikel Harry,$22.15,4.4,Hardcover
2000,74,A Short Guide to a Happy Life,Anna Quindlen,$8.89,4.2,Hardcover
2000,75,Picture Perfect Weight Loss: The Visual Program for Permanent Weight Loss,Dr. Howard M. Shapiro,$5.64,4.4,Hardcover
2000,76,The Cluetrain Manifesto,David Weinberger,$11.59,4.0,Hardcover
2000,77,1001 Ways to Reward Employees,Bob Nelson,$10.84,4.5,Paperback
2000,78,Kitchen Confidential: 25th Anniversary Edition,Anthony Bourdain,$16.59,4.5,Hardcover
2000,79,"Rich Dad, Poor Dad: What the Rich Teach Their Kids about Money - That the Poor and the Middle Class Do Not!",Robert T. Kiyosaki,$18.27,4.6,Paperback
2000,80,The Testament,John Grisham,$7.00,4.5,Mass Market Paperback
2000,81,Open House,Elizabeth Berg,$7.99,4.5,Hardcover
2000,82,"Guns, Germs, and Steel: The Fates of Human Societies",Jared M. Diamond,$15.32,4.5,Paperback
2000,83,"Life Strategies: Doing What Works, Doing What Matters","Phillip C. Mcgraw, ph.d.",$7.99,4.5,Paperback
2000,84,Raving Fans: A Revolutionary Approach To Customer Service,Ken Blanchard,$10.86,4.6,Hardcover
2000,85,Soul Stories,Gary Zukav,$10.99,4.6,Hardcover
2000,86,The One Minute Manager,Kenneth  Blanchard,$11.03,4.7,Paperback
2000,87,'Tis: A Memoir,Frank McCourt,$3.43,4.5,Hardcover
2000,88,The Carbohydrate Addict's Lifespan Program: Personalized Plan for bcmg Slim Fit Healthy your 40s 50s 60s Beyond,Dr. Rachael F. Heller,$8.87,4.4,Paperback
2000,89,The Millionaire Mind,Dr. Thomas J. Stanley,$8.94,4.6,Hardcover
2000,90,Ten Things I Wish I'd Known - Before I Went Out into the Real World,Maria Shriver,$13.16,4.7,Hardcover
2000,91,Crossing the Chasm: Marketing and Selling High-Tech Products to Mainstream Customers,Geoffrey A. Moore,$16.09,4.3,Paperback
2000,92,"The Amber Spyglass (His Dark Materials, Book 3)",Philip Pullman,$16.65,4.5,Hardcover
2000,93,A Map of the World: A Novel (Oprah's Book Club),Jane Hamilton,$10.99,4.1,Paperback
2000,94,On Writing: A Memoir of the Craft,Stephen King,$13.87,4.7,Hardcover
2000,95,The Cake Mix Doctor,Anne Byrn,$11.63,4.7,Paperback
2000,96,Rich Dad's Guide to Investing: What the Rich Invest in That the Poor and Middle Class Do Not!,Robert T. Kiyosaki,$11.35,4.7,Paperback
2000,97,How the Grinch Stole Christmas! (Classic Seuss),Dr. Seuss,$9.05,4.9,Hardcover
2000,98,Dr. Atkins' New Carbohydrate Gram Counter,Robert C. Atkins,$4.95,4.3,Paperback
2000,99,Living on the Fault Line : Managing for Shareholder Value in the Age of the Internet,Geoffrey A. Moore,$6.00,3.7,Hardcover
2000,100,Bridget Jones : The Edge of Reason,Helen Fielding,$8.00,4.3,Hardcover
2002,1,"Good to Great: Why Some Companies Make the Leap...And Others Don't (Good to Great, 1)",Jim Collins,$10.64,4.5,Hardcover
2002,2,Who Moved My Cheese?: An A-Mazing Way to Deal with Change in Your Work and in Your Life,Spencer Johnson,$6.40,4.6,Hardcover
2002,3,The Lovely Bones,Alice Sebold,$9.49,4.3,Hardcover
2002,4,Fish: A Proven Way to Boost Morale and Improve Results,Stephen C. Lundin,$8.97,4.6,Hardcover
2002,5,Stupid White Men ...And Other Sorry Excuses for the State of the Nation!,Michael Moore,$5.65,4.4,Paperback
2002,6,The Nanny Diaries: A Novel,Emma Mclaughlin,$4.90,4.2,Hardcover
2002,7,Self Matters: Creating Your Life from the Inside Out,Phillip C. McGraw,$3.52,4.4,Hardcover
2002,8,Execution: The Discipline of Getting Things Done,Larry Bossidy,$10.99,4.4,Hardcover
2002,9,The Summons,John Grisham,$6.97,3.8,Hardcover
2002,10,"Now, Discover Your Strengths: The revolutionary Gallup program that shows you how to develop your unique talents and strengths",Gallup,$14.85,3.6,Hardcover
2002,11,The Wisdom of Menopause: Creating Physical and Emotional Health and Healing During the Change,Christiane Northrup,$8.73,4.4,Hardcover
2002,12,A Mind at a Time,Mel Levine M.D.,$7.73,4.4,Hardcover
2002,13,Rich Dad Poor Dad: What the Rich Teach Their Kids About Money - That the Poor and the Middle Class Do Not!,Robert T. Kiyosaki,$7.90,4.6,Paperback
2002,14,"First, Break All the Rules: What the World's Greatest Managers Do Differently",Marcus Buckingham,$10.58,4.6,Hardcover
2002,15,Atonement: A Novel,Ian McEwan,$8.49,4.3,Hardcover
2002,16,Red Rabbit,Tom Clancy,$9.00,4.3,Hardcover
2002,17,Slander: Liberal Lies About the American Right,Ann Coulter,$9.94,4.4,Hardcover
2002,18,Bias: A CBS Insider Exposes How the Media Distort the News,Bernard Goldberg,$9.73,4.5,Hardcover
2002,19,The Sopranos Family Cookbook: As Compiled by Artie Bucco,Artie Bucco,$15.74,4.7,Hardcover
2002,20,"The Shelters of Stone (Earth's Children, Book 5)",Jean M. Auel,$13.00,4.6,Hardcover
2002,21,The Power of Now: A Guide to Spiritual Enlightenment,Eckhart Tolle,$17.55,4.7,Hardcover
2002,22,Body for Life: 12 Weeks to Mental and Physical Strength,Bill Phillips,$11.81,4.4,Hardcover
2002,23,The 7 Habits of Highly Effective People,Stephen R. Covey,$8.00,4.6,Paperback
2002,24,Leadership,Rudolph W. Giuliani,$9.00,4.4,Hardcover
2002,25,"Get With the Program!: Getting Real About Your Health, Weight, and Emotional Well-Being",Bob Greene,$9.30,4.4,Hardcover
2002,26,J.R.R. Tolkien Boxed Set (The Hobbit and The Lord of the Rings),J.R.R. Tolkien,$3.55,4.8,Paperback
2002,27,Prey,Michael Crichton,$12.00,4.3,Hardcover
2002,28,What Went Wrong?: Western Impact and Middle Eastern Response,Bernard Lewis,$5.39,4.3,Hardcover
2002,29,Bush at War,Bob Woodward,$8.38,4.4,Hardcover
2002,30,The Perricone Prescription: A Physician's 28-Day Program for Total Body and Face Rejuvenation,Nicholas Perricone M.D.,$13.45,4.4,Hardcover
2002,31,Satisfaction: The Art of the Female Orgasm,Kim Cattrall,$24.61,4.4,Hardcover
2002,32,Dr. Atkins' New Diet Revolution,Robert C. Atkins M.D.,$7.19,4.4,Paperback
2002,33,"The Elements of Style, Fourth Edition",William Strunk Jr.,$9.29,4.7,Paperback
2002,34,Jack: Straight from the Gut,Jack Welch,$12.23,4.4,Hardcover
2002,35,Let Freedom Ring: Winning the War of Liberty over Liberalism,Sean Hannity,$8.24,4.6,Hardcover
2002,36,Sacred Contracts: Awakening Your Divine Potential,Caroline Myss,$11.64,4.6,Hardcover
2002,37,The Four Agreements: A Practical Guide to Personal Freedom (A Toltec Wisdom Book),Don Miguel Ruiz,$7.05,4.7,Paperback
2002,38,Life of Pi,Yann Martel,$14.41,4.4,Hardcover
2002,39,Four Blind Mice (Alex Cross),James Patterson,$8.93,4.6,Hardcover
2002,40,The Beach House,James Patterson,$10.30,4.4,Hardcover
2002,41,"I Don't Know How She Does It: The Life of Kate Reddy, Working Mother",Allison Pearson,$7.79,4.0,Hardcover
2002,42,Wild at Heart: Discovering The Secret of a Man's Soul,John Eldredge,$21.22,4.8,Hardcover
2002,43,Getting to Yes: Negotiating Agreement Without Giving In,Roger Fisher,$16.00,4.5,Paperback
2002,44,Raving Fans: A Revolutionary Approach To Customer Service,Ken Blanchard,$10.86,4.6,Hardcover
2002,45,Fast Food Nation: The Dark Side of the All-American Meal,Eric Schlosser,$6.85,4.5,Paperback
2002,46,Fall On Your Knees (Oprah's Book Club),Ann-Marie MacDonald,$4.68,4.2,Paperback
2002,47,John Adams,David McCullough,$14.23,4.8,Hardcover
2002,48,Primal Leadership: Realizing the Power of Emotional Intelligence,Daniel Goleman,$4.58,4.6,Hardcover
2002,49,Empire Falls,Richard Russo,$7.98,4.4,Paperback
2002,50,A New Kind of Science,Stephen Wolfram,$20.53,4.3,Hardcover
2002,51,8 Minutes in the Morning: A Simple Way to Start Your Day That Burns Fat and Sheds the Pounds,Jorge Cruise,$5.46,4.4,Hardcover
2002,52,"The Healthy Kitchen: Recipes for a Better Body, Life, and Spirit",Andrew Weil,$6.01,4.2,Hardcover
2002,53,"10 Real SATs, Second Edition",The College Board,$5.50,4.5,Paperback
2002,54,Live from New York: An Uncensored History of Saturday Night Live,Tom Shales,$21.05,4.5,Hardcover
2002,55,Conquer the Crash: You Can Survive & Prosper in a Deflationary Depression (Wiley Trading),"Jr. Prechter, Robert R.",$12.93,4.1,Hardcover
2002,56,The Remnant: On the Brink of Armageddon (Left Behind),Tim LaHaye,$9.22,4.7,Hardcover
2002,57,The One Minute Manager,Kenneth  Blanchard,$11.03,4.7,Paperback
2002,58,How to Win Friends & Influence People,Dale Carnegie,$1.75,4.6,Mass Market Paperback
2002,59,2nd Chance,James Patterson,$0.99,4.5,Hardcover
2002,60,Hard Eight (Stephanie Plum),Janet Evanovich,$7.98,4.6,Hardcover
2002,61,The Universe in a Nutshell,Stephen Hawking,$16.95,4.8,Hardcover
2002,62,"The Wrinkle Cure: Unlock the Power of Cosmeceuticals for Supple, Youthful Skin",Nicholas Perricone MD,$4.85,4.3,Paperback
2002,63,Harry Potter Boxset 1-4,J.K. Rowling,$5.27,4.6,Paperback
2002,64,The Red Tent,Anita Diamant,$11.28,4.5,Paperback
2002,65,Master of the Senate: The Years of Lyndon Johnson III,Robert A. Caro,$30.54,4.8,Hardcover
2002,66,Divine Secrets of the Ya-Ya Sisterhood: A Novel,Rebecca Wells,$10.00,4.5,Paperback
2002,67,"The Five Dysfunctions of a Team: A Leadership Fable, 20th Anniversary Edition",Patrick M. Lencioni,$9.74,4.6,Hardcover
2002,68,A Beautiful Mind: The Life of Mathematical Genius and Nobel Laureate John Nash,Sylvia Nasar,$8.00,4.4,Paperback
2002,69,"One Nation: America Remembers September 11, 2001",Editors of Life Magazine,$8.35,4.7,Hardcover
2002,70,Longitudes and Attitudes: Exploring the World After September 11,Thomas L. Friedman,$3.85,4.2,Hardcover
2002,71,Face the Fire (Three Sisters Island Trilogy),Nora Roberts,$9.99,4.6,Mass Market Paperback
2002,72,"In This Mountain (The Mitford Years, Book 7)",Jan Karon,$11.20,4.7,Hardcover
2002,73,The Tipping Point: How Little Things Can Make a Big Difference,Malcolm Gladwell,$9.33,4.4,Paperback
2002,74,Everything's Eventual: 14 Dark Tales,Stephen King,$24.75,4.5,Hardcover
2002,75,Goodnight Moon,Margaret Wise Brown,$6.48,4.9,Board book
2002,76,Rath & Strong's Six Sigma Pocket Guide,Rath & Strong,$26.23,4.4,Spiral-bound
2002,77,The Girlfriends' Guide to Pregnancy: Or everything your doctor won't tell you,Vicki Iovine,$7.16,4.4,Paperback
2002,78,The Goal: A Process of Ongoing Improvement,Eliyahu M. Goldratt,$14.76,4.6,Paperback
2002,79,Bel Canto,Ann Patchett,$13.33,4.3,Paperback
2002,80,Q is for Quarry: A Kinsey Millhone Novel,Sue Grafton,$5.78,4.4,Hardcover
2002,81,Weight Watchers New Complete Cookbook,Weight Watchers International Inc. Staff,$18.28,4.3,Plastic Comb
2002,82,The Emperor of Ocean Park,Stephen L. Carter,$13.59,3.9,Hardcover
2002,83,Portrait of a Killer: Jack the Ripper--Case Closed,Patricia Cornwell,$15.14,4.5,Hardcover
2002,84,The First Days of School: How to Be an Effective Teacher,Harry K. Wong,$29.00,4.6,Paperback
2002,85,The Very Hungry Caterpillar,Eric Carle,$5.75,4.9,Board book
2002,86,"Everyday Grace: Having Hope, Finding Forgiveness, and Making Miracles",Marianne Williamson,$11.01,4.7,Hardcover
2002,87,Mac OS X: The Missing Manual,David Pogue,$9.99,4.2,Paperback
2002,88,"Life Strategies: Doing What Works, Doing What Matters","Phillip C. Mcgraw, ph.d.",$7.99,4.5,Paperback
2002,89,"Brown Bear, Brown Bear, What Do You See?",Bill Martin Jr.,$5.36,4.9,Board book
2002,90,The Hobbit and The Lord of the Rings,J. R. R. Tolkien,$6.79,4.8,Paperback
2002,91,Visions of Sugar Plums: A Stephanie Plum Holiday Novel (Stephanie Plum Novels),Janet Evanovich,$10.88,4.3,Hardcover
2002,92,The Night Before Christmas Pop-up,Clement Clarke Moore,$12.28,4.8,Hardcover
2002,93,The Carnivorous Carnival (A Series of Unfortunate Events # 9),Lemony Snicket,$9.11,4.6,Hardcover
2002,94,I'm Just Here for the Food: Food + Heat = Cooking,Alton Brown,$17.50,4.7,Hardcover
2002,95,The One Minute Millionaire: The Enlightened Way to Wealth,Mark Victor Hansen,$7.72,4.5,Hardcover
2002,96,Rich Dad's Cashflow Quadrant: Rich Dad's Guide to Financial Freedom,Robert T. Kiyosaki,$10.07,4.7,Paperback
2002,97,The Dive From Clausen's Pier,Ann Packer,$9.48,4.0,Hardcover
2002,98,The 21 Irrefutable Laws of Leadership: Follow Them and People Will Follow You,John C. Maxwell,$9.92,4.7,Hardcover
2003,1,Harry Potter and the Order of the Phoenix (Book 5),J. K. Rowling,$15.50,4.8,Hardcover
2003,2,The Da Vinci Code (Robert Langdon),Dan Brown,$12.97,4.3,Hardcover
2003,3,"The South Beach Diet: The Delicious, Doctor-Designed, Foolproof Plan for Fast and Healthy Weight Loss",Arthur Agatston,$9.14,4.4,Hardcover
2003,4,"Good to Great: Why Some Companies Make the Leap...And Others Don't (Good to Great, 1)",Jim Collins,$10.64,4.5,Hardcover
2003,5,The Purpose Driven Life,Rick Warren,$15.63,4.6,Hardcover
2003,6,Lies and the Lying Liars Who Tell Them,Al Franken,$5.26,4.5,Hardcover
2003,7,The Secret Life of Bees,Sue Monk Kidd,$8.60,4.6,Paperback
2003,8,The Five People You Meet in Heaven,Mitch Albom,$10.00,4.6,Hardcover
2003,9,Who Moved My Cheese?: An A-Mazing Way to Deal with Change in Your Work and in Your Life,Spencer Johnson,$6.40,4.6,Hardcover
2003,10,Execution: The Discipline of Getting Things Done,Larry Bossidy,$10.99,4.4,Hardcover
2003,11,Dr. Atkins' New Diet Revolution,Robert C. Atkins M.D.,$7.19,4.4,Paperback
2003,12,"Now, Discover Your Strengths: The revolutionary Gallup program that shows you how to develop your unique talents and strengths",Gallup,$14.85,3.6,Hardcover
2003,13,Life of Pi: A Novel,Yann Martel,$9.99,4.4,Paperback
2003,14,Seabiscuit: An American Legend (Ballantine Reader's Circle),Laura Hillenbrand,$9.85,4.6,Paperback
2003,15,A Short History of Nearly Everything,Bill Bryson,$17.39,4.6,Hardcover
2003,16,The King of Torts,John Grisham,$11.24,4.3,Hardcover
2003,17,Living History,Hillary Rodham Clinton,$7.78,4.4,Hardcover
2003,18,"500 Low-Carb Recipes: 500 Recipes, from Snacks to Dessert, That the Whole Family Will Love",Dana Carpender,$9.90,4.3,Paperback
2003,19,The Ultimate Weight Solution (The 7 Keys to Weight Loss Freedom),Dr. Phil McGraw,$8.69,4.1,Hardcover
2003,20,Angels & Demons,Dan Brown,$0.49,4.5,Mass Market Paperback
2003,21,Fish: A Proven Way to Boost Morale and Improve Results,Stephen C. Lundin,$8.97,4.6,Hardcover
2003,22,The Essential 55: An Award-Winning Educator's Rules for Discovering the Successful Student in Every Child,Ron Clark,$10.06,4.6,Hardcover
2003,23,The Lovely Bones,Alice Sebold,$9.49,4.3,Hardcover
2003,24,Moneyball: The Art of Winning an Unfair Game,Michael Lewis,$13.83,4.6,Hardcover
2003,25,"Dude, Where's My Country?",Michael Moore,$9.58,4.4,Hardcover
2003,26,"East of Eden, John Steinbeck Centennial Edition",John Steinbeck,$14.98,4.7,Paperback
2003,27,The 7 Habits of Highly Effective People,Stephen R. Covey,$8.00,4.6,Paperback
2003,28,Treason: Liberal Treachery from the Cold War to the War on Terrorism,Ann Coulter,$11.00,4.6,Hardcover
2003,29,Stupid White Men ...And Other Sorry Excuses for the State of the Nation!,Michael Moore,$5.65,4.4,Paperback
2003,30,Rich Dad Poor Dad: What the Rich Teach Their Kids About Money - That the Poor and the Middle Class Do Not!,Robert T. Kiyosaki,$7.90,4.6,Paperback
2003,31,"The Five Dysfunctions of a Team: A Leadership Fable, 20th Anniversary Edition",Patrick M. Lencioni,$9.74,4.6,Hardcover
2003,32,Benjamin Franklin: An American Life,Walter Isaacson,$16.57,4.6,Hardcover
2003,33,Dr. Atkins' New Carbohydrate Gram Counter,Robert C. Atkins,$4.95,4.3,Paperback
2003,34,Atkins for Life: The Complete Controlled Carb Program for Permanent Weight Loss and Good Health,Robert C. Atkins,$1.25,4.3,Hardcover
2003,35,"First, Break All the Rules: What the World's Greatest Managers Do Differently",Marcus Buckingham,$10.58,4.6,Hardcover
2003,36,"The Elements of Style, Fourth Edition",William Strunk Jr.,$9.29,4.7,Paperback
2003,37,Complete Atkins' Three Book Package,Robert C. Atkins,$25.58,4.4,Hardcover
2003,38,Wolves of the Calla (Dark Tower),Stephen King,$32.77,4.7,Hardcover
2003,39,"The Power of Full Engagement: Managing Energy, Not Time, Is the Key to High Performance and Personal Renewal",Jim Loehr,$15.97,4.6,Hardcover
2003,40,The Power of Now: A Guide to Spiritual Enlightenment,Eckhart Tolle,$17.55,4.7,Hardcover
2003,41,Bleachers,John Grisham,$6.24,4.2,Hardcover
2003,42,What Should I Do With My Life: The True Story of People Who Answered the Ultimate Question,Po Bronson,$8.49,4.5,Hardcover
2003,43,Rachael Ray 30-Minute Meals 2,Rachael Ray,$4.98,4.4,Paperback
2003,44,Bel Canto,Ann Patchett,$13.33,4.3,Paperback
2003,45,How to Win Friends & Influence People,Dale Carnegie,$1.75,4.6,Mass Market Paperback
2003,46,Fast Food Nation: The Dark Side of the All-American Meal,Eric Schlosser,$6.85,4.5,Paperback
2003,47,Wild at Heart: Discovering The Secret of a Man's Soul,John Eldredge,$21.22,4.8,Hardcover
2003,48,Dereliction of Duty: The Eyewitness Account of How President Bill Clinton Compromised America's Long-Term National Security,Robert Patterson,$4.98,4.5,Hardcover
2003,49,Where Is Baby's Belly Button? A Lift-the-Flap Book,Karen Katz,$5.99,4.8,Board book
2003,50,Harry Potter Boxset 1-4,J.K. Rowling,$5.27,4.6,Paperback
2003,51,The No. 1 Ladies' Detective Agency (Book 1),Alexander McCall Smith,$6.41,4.3,Paperback
2003,52,Getting to Yes: Negotiating Agreement Without Giving In,Roger Fisher,$16.00,4.5,Paperback
2003,53,The Teeth of the Tiger,Tom Clancy,$7.33,4.2,Hardcover
2003,54,Raving Fans: A Revolutionary Approach To Customer Service,Ken Blanchard,$10.86,4.6,Hardcover
2003,55,J.R.R. Tolkien Boxed Set (The Hobbit and The Lord of the Rings),J.R.R. Tolkien,$3.55,4.8,Paperback
2003,56,The Very Hungry Caterpillar,Eric Carle,$5.75,4.9,Board book
2003,57,The Tipping Point: How Little Things Can Make a Big Difference,Malcolm Gladwell,$9.33,4.4,Paperback
2003,58,Body for Life: 12 Weeks to Mental and Physical Strength,Bill Phillips,$11.81,4.4,Hardcover
2003,59,To the Nines: Stephanie Plum Novels,Janet Evanovich,$6.38,4.6,Hardcover
2003,60,Eragon (Inheritance),Christopher Paolini,$15.77,4.7,Hardcover
2003,61,The Hours,Michael Cunningham,$7.40,4.3,Mass Market Paperback
2003,62,Who's Looking Out for You?,Bill O'Reilly,$7.17,4.4,Hardcover
2003,63,Deception Point,Dan Brown,$13.50,4.4,Mass Market Paperback
2003,64,Bushwhacked: Life in George W. Bush's America,Molly Ivins,$8.38,4.6,Hardcover
2003,65,Beyond Belief: The Secret Gospel of Thomas,Elaine Pagels,$16.30,4.5,Hardcover
2003,66,Holes (Holes Series),Louis Sachar,$6.99,4.7,Paperback
2003,67,30-Minute Meals,Rachael Ray,$9.93,4.4,Paperback
2003,68,8 Minutes in the Morning: A Simple Way to Shed Up to 2 Pounds a Week -- Guaranteed,Jorge Cruise,$11.49,4.2,Paperback
2003,69,"The Savage Nation: Saving America from the Liberal Assault on Our Borders, Language and Culture",Michael Savage,$7.10,4.6,Hardcover
2003,70,Under the Banner of Heaven: A Story of Violent Faith,Jon Krakauer,$16.33,4.4,Hardcover
2003,71,"Brown Bear, Brown Bear, What Do You See?",Bill Martin Jr.,$5.36,4.9,Board book
2003,72,Harry Potter and the Order of the Phoenix (Book 5),J. K. Rowling,$32.18,4.8,Hardcover
2003,73,"The Devil in the White City: Murder, Magic, and Madness at the Fair That Changed America",Erik Larson,$14.73,4.3,Hardcover
2003,74,The One Minute Manager,Kenneth  Blanchard,$11.03,4.7,Paperback
2003,75,The Complete Far Side: 1980-1994,Gary Larson,$131.48,4.9,Hardcover
2003,76,Leap of Faith: Memoirs of an Unexpected Life,Queen Noor,$4.92,4.4,Hardcover
2003,77,"1,000 Places to See Before You Die: A Traveler's Life List",Patricia Schultz,$10.97,4.5,Paperback
2003,78,"Oh, the Places You'll Go!",Dr. Seuss,$8.48,4.9,Hardcover
2003,79,The Five Love Languages: How to Express Heartfelt Commitment to Your Mate,Gary Chapman,$7.89,4.7,Paperback
2003,80,What to Expect When You're Expecting,Heidi Murkoff,$12.00,4.7,Paperback
2003,81,The Big Bad Wolf,James Patterson,$9.68,4.6,Hardcover
2003,82,Mrs. Dalloway: The Virginia Woolf Library Authorized Edition,Virginia Woolf,$5.93,4.1,Paperback
2003,83,Atonement: A Novel,Ian McEwan,$10.64,4.3,Paperback
2003,84,The Goal: A Process of Ongoing Improvement,Eliyahu M. Goldratt,$14.76,4.6,Paperback
2003,85,The Four Agreements: A Practical Guide to Personal Freedom (A Toltec Wisdom Book),Don Miguel Ruiz,$7.05,4.7,Paperback
2003,86,Life of Pi,Yann Martel,$14.41,4.4,Hardcover
2003,87,"Merriam-Webster's Collegiate Dictionary, 11th Edition, Jacketed Hardcover, Indexed",Merriam-Webster,$17.41,4.7,Hardcover
2003,88,Goodnight Moon,Margaret Wise Brown,$6.48,4.9,Board book
2003,89,Harry Potter and the Order of the Phoenix (Book 5),J.K. Rowling,$64.95,4.8,Audio CD
2003,90,The Good Carb Cookbook: Secrets of Eating Low on the Glycemic Index,Sandra Woodruff,$10.29,4.1,Paperback
2003,91,Kate Remembered,A. Scott Berg,$10.32,4.6,Hardcover
2003,92,"The Slippery Slope (A Series of Unfortunate Events, Book 10) (A Series of Unfortunate Events, 10)",Lemony Snicket,$8.93,4.7,Hardcover
2003,93,Nickel and Dimed: On (Not) Getting By in America,Barbara Ehrenreich,$5.14,4.3,Paperback
2003,94,Digital Fortress: A Thriller,Dan Brown,$8.23,4.3,Paperback
2003,95,"Who's Your Caddy?: Looping for the Great, Near Great, and Reprobates of Golf",Rick Reilly,$13.66,4.4,Hardcover
2003,96,The First Days of School: How to Be an Effective Teacher,Harry K. Wong,$29.00,4.6,Paperback
2003,97,What to Expect the First Year,Arlene Eisenberg,$13.25,4.7,Paperback
2003,98,The Great Unraveling: Losing Our Way in the New Century,Paul Krugman,$7.45,4.2,Hardcover
2003,99,Schott's Original Miscellany,Ben Schott,$13.25,4.5,Hardcover
2004,1,The Da Vinci Code (Robert Langdon),Dan Brown,$12.97,4.3,Hardcover
2004,2,America (The Book): A Citizen's Guide to Democracy Inaction,Jon Stewart,$9.16,4.5,Hardcover
2004,3,"Good to Great: Why Some Companies Make the Leap...And Others Don't (Good to Great, 1)",Jim Collins,$10.64,4.5,Hardcover
2004,4,"The South Beach Diet: The Delicious, Doctor-Designed, Foolproof Plan for Fast and Healthy Weight Loss",Arthur Agatston,$9.14,4.4,Hardcover
2004,5,My Life,Bill Clinton,$6.99,4.3,Hardcover
2004,6,"Eats, Shoots & Leaves: The Zero Tolerance Approach to Punctuation",Lynne Truss,$6.99,4.5,Hardcover
2004,7,The Five People You Meet in Heaven,Mitch Albom,$10.00,4.6,Hardcover
2004,8,Harry Potter and the Half-Blood Prince (Book 6),J. K. Rowling,$16.41,4.8,Hardcover
2004,9,Angels & Demons,Dan Brown,$0.49,4.5,Mass Market Paperback
2004,10,He's Just Not That Into You: The No-Excuses Truth to Understanding Guys,Greg Behrendt,$6.74,4.5,Hardcover
2004,11,The Purpose Driven Life,Rick Warren,$15.63,4.6,Hardcover
2004,12,Unfit For Command: Swift Boat Veterans Speak Out Against John Kerry,John E. O'Neill,$8.82,4.6,Hardcover
2004,13,The 9/11 Commission Report: Final Report of the National Commission on Terrorist Attacks Upon the United States,National Commission on Terrorist Attacks,$9.49,4.5,Paperback
2004,14,"Now, Discover Your Strengths: The revolutionary Gallup program that shows you how to develop your unique talents and strengths",Gallup,$14.85,3.6,Hardcover
2004,15,The South Beach Diet Good Fats/Good Carbs Guide: The Complete and Easy Reference for All Your Favorite Foods,Arthur Agatston,$6.99,4.3,Paperback
2004,16,Who Moved My Cheese?: An A-Mazing Way to Deal with Change in Your Work and in Your Life,Spencer Johnson,$6.40,4.6,Hardcover
2004,17,Against All Enemies: Inside America's War on Terror,Richard A. Clarke,$9.88,4.5,Hardcover
2004,18,The Proper Care and Feeding of Husbands,Laura Schlessinger,$6.55,4.6,Hardcover
2004,19,The South Beach Diet Cookbook,Arthur Agatston,$11.25,4.4,Hardcover
2004,20,Plan of Attack,Bob Woodward,$10.43,4.4,Hardcover
2004,21,Execution: The Discipline of Getting Things Done,Larry Bossidy,$10.99,4.4,Hardcover
2004,22,"The Five Dysfunctions of a Team: A Leadership Fable, 20th Anniversary Edition",Patrick M. Lencioni,$9.74,4.6,Hardcover
2004,23,The Polar Express,Chris Van Allsburg,$16.90,4.7,Hardcover
2004,24,The Secret Life of Bees,Sue Monk Kidd,$8.60,4.6,Paperback
2004,25,Life of Pi: A Novel,Yann Martel,$9.99,4.4,Paperback
2004,26,The Automatic Millionaire: A Powerful One-Step Plan to Live and Finish Rich,David Bach,$14.99,4.6,Hardcover
2004,27,Rich Dad Poor Dad: What the Rich Teach Their Kids About Money - That the Poor and the Middle Class Do Not!,Robert T. Kiyosaki,$7.90,4.6,Paperback
2004,28,The Rule of Four,Ian Caldwell,$11.99,3.8,Hardcover
2004,29,Deception Point,Dan Brown,$13.50,4.4,Mass Market Paperback
2004,30,The Ultimate Weight Solution (The 7 Keys to Weight Loss Freedom),Dr. Phil McGraw,$8.69,4.1,Hardcover
2004,31,The Kite Runner,Khaled  Hosseini,$11.21,4.7,Paperback
2004,32,"Chronicles, Vol. 1",Bob Dylan,$30.77,4.5,Hardcover
2004,33,The 7 Habits of Highly Effective People,Stephen R. Covey,$8.00,4.6,Paperback
2004,34,The Curious Incident of the Dog in the Night-Time,Mark Haddon,$8.62,4.2,Paperback
2004,35,The Ultimate Weight Solution Food Guide,Dr. Phil McGraw,$1.39,4.0,Mass Market Paperback
2004,36,The Last Juror: A Novel,John Grisham,$11.96,4.5,Hardcover
