year,rank,title,author,price,rating,format
1995,1,How to Set Up and Maintain a World Wide Web Site: The Guide for Information Providers,Lincoln Stein,$3.99,1.0,Hardcover
1995,2,A Mathematician Reads The Newspaper,John Allen Paulos,$7.00,4.7,Hardcover
1995,3,Brightness Reef (Bantam Spectra Book),David Brin,$21.99,4.2,Hardcover
1995,4,Silicon Snake Oil: Second Thoughts on the Information Highway,Clifford Stoll,$15.41,4.0,Hardcover
1995,5,The Dark and Deadly Pool,Joan Lowery Nixon,$1.49,4.3,Mass Market Paperback
1995,6,Being Digital,Nicholas Negroponte,$14.60,4.4,Hardcover
1995,7,Learning the UNIX Operating System (Nutshell Handbooks),Jerry Peek,$9.95,5.0,Paperback
1995,8,Emblems of Mind: The Inner Life of Music and Mathematics,Edward Rothstein,$2.25,4.3,Hardcover
1995,9,Fluid Concepts And Creative Analogies: Computer Models Of The Fundamental Mechanisms Of Thought,Douglas R. Hofstadter,$27.01,4.5,Hardcover
1995,10,The Bold Vegetarian: 150 Inspired International Recipes,B. Kirchner,$22.03,4.6,Paperback
1995,11,Copy Workshop Workbook: Second Edition,Bruce Bendinger,$62.03,3.8,Paperback
1995,12,N/A,N/A,$8.84,4.4,N/A
1995,13,The Beak of the Finch: A Story of Evolution in Our Time,Jonathan Weiner,$11.09,4.6,Paperback
1995,14,"The Diamond Age, or, A Young Lady's Illustrated Primer",Neal Stephenson,$5.76,4.4,Hardcover
1995,15,"Gödel, Escher, Bach: An Eternal Golden Braid",Douglas Hofstadter,$39.99,4.4,Paperback
1995,16,"Sundiver (The Uplift Saga, Book 1)",David Brin,$2.27,4.1,Mass Market Paperback
1995,17,An Anthropologist On Mars: Seven Paradoxical Tales,Oliver Sacks,$20.76,4.6,Hardcover
1995,18,The Language Instinct: How the Mind Creates Language,Steven Pinker,$13.90,4.5,Paperback
1995,19,It's Obvious You Won't Survive By Your Wits Alone (Volume 6),Scott Adams,$1.00,4.1,Paperback
1995,20,"Applied Cryptography: Protocols, Algorithms, and Source Code in C",Bruce Schneier,$59.31,4.4,Paperback
1995,21,"The Uplift War (The Uplift Saga, Book 3)",David Brin,$1.52,4.5,Mass Market Paperback
1995,22,The Lost World,Michael Crichton,$13.44,4.6,Hardcover
1995,23,"Debugging the Development Process: Practical Strategies for Staying Focused, Hitting Ship Dates, and Building Solid Teams",Steve Maguire,$14.55,4.2,Paperback
1995,24,Emotional Intelligence: Why It Can Matter More than IQ,Daniel Goleman,$9.17,4.6,Hardcover
1995,25,Doomsday Book,Connie Willis,$2.09,4.4,Mass Market Paperback
1995,26,"Startide Rising (The Uplift Saga, Book 2)",David Brin,$1.95,4.4,Mass Market Paperback
1995,27,HIGH TRAIL TO DANGER (A Bantam Starfire Book),Meg O'Brien,$6.00,2.0,Mass Market Paperback
1995,28,The Art of War (Shambhala Pocket Classics),Sun Tzu,$8.95,4.5,Paperback
1995,29,Communities Directory: A Guide to Cooperative Living :1995 (Communities Directory: A Guide to Intentional Communities & Cooperative Living),Fellowship for Intentional Community,$19.99,2.0,Paperback
1995,30,The Age of Innocence,David Hamilton,$85.00,4.1,Hardcover
1995,31,Learning Perl (Nutshell Handbooks),"Andy (editor) Schwartz, Randal L.; Oram",$8.39,4.8,Paperback
1995,32,"Mirror Image (Tom Clancy's Op-Center, Book 2)",Tom Clancy,$7.43,4.4,Mass Market Paperback
1995,33,Snow Falling On Cedars,David Guterson,$9.91,4.3,Paperback
1995,34,Life on the Screen,Sherry Turkle,$13.05,4.2,Hardcover
1995,35,The Calvin and Hobbes Tenth Anniversary Book (Volume 13),Bill Watterson,$11.49,4.8,Paperback
1995,36,Inside the Tornado: Marketing Strategies from Silicon Valley's Cutting Edge,Geoffrey A. Moore,$19.85,4.5,Hardcover
1995,37,The Big Book of Weirdos,Carl A. Posey,$5.63,4.9,Paperback
1995,38,Valis,Philip K. Dick,$15.00,4.4,Paperback
1995,39,Snow Crash,Neal Stephenson,$3.21,4.3,Mass Market Paperback
1995,40,Six Easy Pieces: Essentials of Physics Explained by Its Most Brilliant Teacher (boxed set: hardcover book + 6 CDs),Richard P. Feynman,$44.78,4.6,Paperback
1995,41,Joseph J. Phillips,Joseph J. Phillips,$7.26,N/A,Paperback
1995,42,Permutation City,Greg Egan,$26.18,4.2,Mass Market Paperback
1995,43,The Innkeeper's Song,Peter S. Beagle,$45.00,4.3,Paperback
1995,44,"Insanely Great: The Life and Times of Macintosh, the Computer that Changed Everything",Steven Levy,$1.75,4.4,Paperback
1995,45,Molecular Biology of the Cell 3E,Bruce Alberts,$69.99,4.6,Hardcover
1995,46,The Race,Eliyahu M. Goldratt,$15.95,4.6,Paperback
1995,47,Surfing the Himalayas: A Spiritual Adventure,Frederick Lenz,$12.27,4.6,Hardcover
1995,48,The Horse Whisperer,Nicholas Evans,$15.15,4.5,Hardcover
1995,49,The Physics Of Star Trek,Lawrence M. Krauss,$13.08,4.6,Hardcover
1995,50,Red Mars (Mars Trilogy),Kim Stanley Robinson,$36.47,4.2,Mass Market Paperback
1995,51,Politically Correct Holiday Stories: For an Enlightened Yuletide Season,James Finn Garner,$7.86,4.5,Hardcover
1995,52,The Stone Diaries,Carol Diggory Shields,$4.95,4.2,Paperback
1995,53,Longitude: The True Story of a Lone Genius Who Solved the Greatest Scientific Problem of His Time,Dava Sobel,$14.43,4.4,Hardcover
1995,54,Gold: The Final Science Fiction Collection,Isaac Asimov,$1.87,4.2,Hardcover
1995,55,Lady Cottington's Pressed Fairy Book,Terry Jones,$8.31,4.8,Hardcover
1995,56,Sponging: A Guide to Living Off Those You Love,Anthony E. Marsh,$9.97,5.0,Paperback
1995,57,"Out of Control: The New Biology of Machines, Social Systems, & the Economic World",Kevin Kelly,$12.92,4.7,Paperback
1995,58,Legacy,Greg Bear,$14.82,4.0,Hardcover
1995,59,Show Stopper!: The Breakneck Race to Create Windows NT and the Next Generation at Microsoft,G. Pascal Zachary,$41.89,4.3,Hardcover
1995,60,Beyond Prozac: Antidotes for Modern Times,Michael J. Norden,$19.99,4.6,Hardcover
1995,61,The Illusion of Life: Disney Animation,Ollie Johnston,$34.00,4.9,Hardcover
1995,62,Dark Rivers of the Heart,Dean Koontz,$12.60,4.4,Mass Market Paperback
1995,63,My American Journey: An Autobiography,Colin L. Powell,$9.28,4.7,Hardcover
1995,64,"MICROSOFT SECRETS: How the World's Most Powerful Software Company Creates Technology, Shapes Markets, and Manages People",Michael A. Cusumano,$16.45,4.4,Hardcover
1995,65,Your Money or Your Life: Transforming Your Relationship with Money and Achieving Financial MORE,Joe Dominguez,$17.99,4.3,Paperback
1995,66,PGP: Pretty Good Privacy,Simson Garfinkel,$32.82,4.2,Paperback
1995,67,Islam,Fazlur Rahman,$14.72,4.4,Paperback
1995,68,World Wide Web Marketing: Integrating the Internet into Your Marketing Strategy,Jim Sterne,$59.70,4.1,Paperback
1995,69,Interface,Stephen Bury,$2.30,4.2,Paperback
1995,70,Lenin's Tomb: The Last Days of the Soviet Empire (Pulitzer Prize Winner),David Remnick,$13.98,4.6,Paperback
1995,71,The Digital Economy: Promise and Peril in the Age of Networked Intelligence,Don Tapscott,$1.75,4.1,Hardcover
1995,72,Necroscope V: Deadspawn,Brian Lumley,$3.18,4.7,Mass Market Paperback
1995,73,Software Development: A Legal Guide/Book and Disk,Stephen Fishman,$60.00,2.0,Paperback
1995,74,The End of Racism: Principles for a Multiracial Society,Dinesh D'Souza,$12.96,4.7,Hardcover
1995,75,Lost Moon the Perilous Voyage of Apollo 13 Signed Edition,Jim Lovell,$29.89,3.9,Hardcover
1995,76,C++ Programmer's Guide to the Standard Template Library,Mark Nelson,$8.67,4.5,Paperback
1995,77,"The Prize: The Epic Quest for Oil, Money, & Power",Daniel Yergin,$4.88,4.7,Paperback
1995,78,How to Save the World,Charles Sheffield,$17.91,3.5,Hardcover
1995,79,I Sing the Body Electronic : A Year With Microsoft on the Multimedia Frontier,Fred Moody,$21.00,4.3,Paperback
1995,80,Microserfs,Douglas Coupland,$2.32,4.1,Hardcover
1995,81,The Structure of Scientific Revolutions,Thomas S. Kuhn,$2.94,4.6,Paperback
1995,82,Lincoln,David Herbert Donald,$17.93,4.6,Hardcover
1995,83,Hooked on Java: Creating Hot Web Sites With Java Applets,Arthur Van Hoff,$13.85,1.0,Paperback
1995,84,"I, Asimov: A Memoir",Isaac Asimov,$8.99,4.6,Paperback
1995,85,Re-Zoom,Istvan Banyai,$22.98,4.7,Hardcover
1995,86,Solve Your Child's Sleep Problems,Richard Ferber,$13.95,4.4,Paperback
1995,87,"City of Bits: Space, Place, and the Infobahn",William J. Mitchell,$1.99,4.3,Hardcover
1995,88,Programming Perl (Nutshell Handbooks),Randal L. Schwartz,$1.35,5.0,Paperback
1995,89,P. O'Brian,P. O'Brian,N/A,N/A,Hardcover
1995,90,David Brinkley,David Brinkley,$10.23,4.7,Hardcover
1995,91,The Killer Angels: The Classic Novel of the Civil War,Michael Shaara,$1.29,4.7,Mass Market Paperback
1995,92,Jim Fobel's Big Flavors,Jim Fobel,$19.95,5.0,Paperback
1995,93,Peopleware : Productive Projects and Teams,Tom Demarco,$16.97,4.6,Paperback
1995,94,The Vision Of The Anointed: Self-congratulation As A Basis For Social Policy,Thomas Sowell,$51.99,4.8,Hardcover
1995,95,Charles Kuralt's America,Charles Kuralt,$9.78,4.5,Hardcover
1995,96,"Behind the Lines (Corps, Vol 7)",W.E.B. Griffin,$9.24,4.6,Hardcover
1995,97,The Wall Street Journal Book of Personal Technology,Walter S. Mossberg,$19.27,1.0,Paperback
1996,1,Creating Killer Web Sites: The Art of Third-Generation Site Design,David Siegel,$24.39,4.0,Paperback
1996,2,Executive Orders,Tom Clancy,$11.98,4.6,Hardcover
1996,3,"The Dilbert Principle: A Cubicle's-Eye View of Bosses, Meetings, Management Fads & Other Workplace Afflictions",Scott Adams,$21.00,4.4,Hardcover
1996,4,Against the Gods: The Remarkable Story of Risk,Peter L. Bernstein,$23.27,4.4,Hardcover
1996,5,The English Patient: Man Booker Prize Winner,Michael Ondaatje,$11.07,4.2,Paperback
1996,6,Idoru,William Gibson,$19.85,4.4,Hardcover
1996,7,Airframe,Michael Crichton,$6.16,4.4,Hardcover
1996,8,Creating Great Web Graphics,Laurie McCanna,$3.39,5.0,Paperback
1996,9,Dogbert's Top Secret Management Handbook,Scott Adams,$1.70,4.6,Hardcover
1996,10,Where Wizards Stay Up Late: The Origins of the Internet,Katie Hafner,$27.71,4.5,Hardcover
1996,11,The Visual Display of Quantitative Information,Edward R. TUFTE,$19.69,4.4,Paperback
1996,12,Inside the Tornado: Marketing Strategies from Silicon Valley's Cutting Edge,Geoffrey A. Moore,$19.85,4.5,Hardcover
1996,13,Woe Is I: The Grammarphobe's Guide to Better English in Plain English,Patricia T. O'Conner,$10.76,4.4,Hardcover
1996,14,"Undaunted Courage: Meriwether Lewis, Thomas Jefferson and the Opening of the American West",Stephen E. Ambrose,$21.64,4.6,Hardcover
1996,15,Only the Paranoid Survive,Andrew S. Grove,$32.95,4.4,Hardcover
1996,16,Dave Barry In Cyberspace,Dave Barry,$10.27,4.2,Hardcover
1996,17,NetSpy,NetGuide,$1.90,1.2,Paperback
1996,18,Martha Stuart's Better Than You at Entertaining (A Parody),Tom Connor,$22.96,4.6,Paperback
1996,19,Programming Perl,Tom Christiansen,$7.90,3.9,Paperback
1996,20,Crossing the Chasm: Marketing and Selling High-Tech Products to Mainstream Customers,Geoffrey A. Moore,$1.31,4.1,Paperback
1996,21,Virus of the Mind: The New Science of the Meme,Richard Brodie,$23.99,4.3,Hardcover
1996,22,World Wide Web Marketing: Integrating the Internet into Your Marketing Strategy,Jim Sterne,$59.70,4.1,Paperback
1996,23,"Out of Control: The New Biology of Machines, Social Systems, & the Economic World",Kevin Kelly,$12.92,4.7,Paperback
1996,24,The Witch Doctors,John Micklethwait,$14.70,4.2,Hardcover
1996,25,24 Hours in Cyberspace: Photographed on One Day by 150 of the World's Leading Photojournalists,Jennifer Erwitt,$10.85,4.0,Hardcover
1996,26,The Pinball Effect: How Renaissance Water Gardens Made the Carburetor Possible-And Other Journeys Through Knowledge,James Burke,$11.67,4.4,Paperback
1996,27,Snow Falling On Cedars,David Guterson,$9.91,4.3,Paperback
1996,28,The Stars My Destination,Alfred Bester,$21.45,4.3,Paperback
1996,29,It's Obvious You Won't Survive By Your Wits Alone (Volume 6),Scott Adams,$1.00,4.1,Paperback
1996,30,"How Brains Think: Evolving Intelligence, Then And Now (Science Masters)",William H. Calvin,$8.00,4.1,Hardcover
1996,31,Java in a Nutshell: A Desktop Quick Reference for Java Programmers (Nutshell Handbooks),David Flanagan,$8.95,5.0,Paperback
1996,32,What Works on Wall Street: A Guide to the Best-Performing Investment Strategies of All Time,James P. O'Shaughnessy (Author),$15.82,4.1,Hardcover
1996,33,Why Things Bite Back: Technology and the Revenge of Unintended Consequences,Edward Tenner,$15.98,4.4,Hardcover
1996,34,Ender's Game (The Ender Quintet),Orson Scott Card,$1.58,4.6,Mass Market Paperback
1996,35,Rapid Development: Taming Wild Software Schedules,Steve McConnell,$24.18,4.4,Paperback
1996,36,"Born to Rebel: Birth Order, Family Dynamics, and Creative Lives",Frank J. Sulloway,$17.48,4.1,Hardcover
1996,37,Enter The Zone: A Dietary Road map,Barry Sears,$14.19,4.4,Hardcover
1996,38,The 7 Habits of Highly Effective People,Stephen R. Covey,$8.00,4.6,Paperback
1996,39,Being Digital,Nicholas Negroponte,$7.35,4.4,Paperback
1996,40,The Book of Ruth,Jane Hamilton,$5.00,4.1,Paperback
1996,41,God: A Biography: Pulitzer Prize Winner,Jack Miles,$13.52,4.3,Paperback
1996,42,The Digital Economy: Promise and Peril in the Age of Networked Intelligence,Don Tapscott,$1.75,4.1,Hardcover
1996,43,"History Laid Bare: Love, Sex, and Perversity from the Ancient Etruscans to Warren G. Harding",Richard Zacks,$27.00,4.4,Paperback
1996,44,The Yellow Admiral,Patrick O'Brian,$12.75,4.6,Hardcover
1996,45,"Hyperspace: A Scientific Odyssey Through Parallel Universes, Time Warps, and the 10th Dimension",Michio Kaku,$11.98,4.7,Paperback
1996,46,Fermat's Last Theorem: Unlocking the Secret of an Ancient Mathematical Problem,Amir D. Aczel,$2.91,4.5,Paperback
1996,47,Snow Crash,Neal Stephenson,$3.21,4.3,Mass Market Paperback
1996,48,Angela's Ashes (The Frank McCourt Memoirs),Frank McCourt,$12.08,4.4,Hardcover
1996,49,Extraordinary Popular Delusions & the Madness of Crowds,Charles Mackay,$24.07,3.6,Paperback
1996,50,Longitude: The True Story of a Lone Genius Who Solved the Greatest Scientific Problem of His Time,Dava Sobel,$14.43,4.4,Hardcover
1996,51,The Rules: Time-Tested Secrets for Capturing the Heart of Mr. Right,Ellen Fein,$1.60,4.3,Mass Market Paperback
1996,52,M is for Malice (The Kinsey Millhone Alphabet Mysteries),Sue Grafton,$6.75,4.5,Hardcover
1996,53,Emotional Intelligence: Why It Can Matter More than IQ,Daniel Goleman,$9.17,4.6,Hardcover
1996,54,The HTML Sourcebook: A Complete Guide to HTML 3.0,Ian S. Graham,$1.49,5.0,Paperback
1996,55,Linda Weinman,Linda Weinman,$19.77,N/A,Paperback
1996,56,Slouching Towards Gomorrah,Robert H. Bork,$12.59,4.7,Hardcover
1996,57,Planning and Managing Web Sites on the Macintosh: The Complete Guide to Webstar and Machttp,Jon Wiederspan,$19.00,1.0,Paperback
1996,58,A Reporter's Life,Walter Cronkite,$12.00,4.5,Hardcover
1996,59,The Microsoft Way: The Real Story Of How The Company Outsmarts Its Competition,Randall E. Stross,$13.91,4.4,Hardcover
1996,60,The Laws of Our Fathers,Scott Turow,$11.08,3.7,Hardcover
1996,61,DARWIN'S DANGEROUS IDEA: EVOLUTION AND THE MEANINGS OF LIFE,Daniel C. Dennett,$12.98,4.4,Paperback
1996,62,Great Books,David Denby,$19.27,4.3,Hardcover
1996,63,"A Crown of Swords (The Wheel of Time, Book 7) (Wheel of Time, 7)",Robert Jordan,$31.59,4.6,Hardcover
1996,64,Alias Grace,Margaret Atwood,$27.00,4.3,Hardcover
1996,65,The Terminal Experiment,Robert J. Sawyer,$2.00,4.3,Paperback
1996,66,Masters of Deception: The Gang That Ruled Cyberspace,Michele Slatalla,$9.99,4.6,Paperback
1996,67,Spontaneous Healing: How to Discover and Enhance Your Body's Natural Ability to Maintain and Heal Itself,Andrew Weil,$6.58,4.5,Paperback
1996,68,Unlimited Access: An FBI Agent Inside the Clinton White House,Gary Aldrich,$7.00,4.6,Hardcover
1996,69,The Diamond Age,Neal Stephenson,$2.23,4.4,Paperback
1996,70,Jamming: The Art and Discipline of Business Creativity,John J. Kao,$9.90,3.8,Hardcover
1996,71,Caligari Truespace2 Bible,Peter M. Plantec,$12.51,5.0,Paperback
1996,72,How the Irish Saved Civilization: The Untold Story of Ireland's Heroic Role From the Fall of Rome to the Rise of Medieval Europe (The Hinges of History),Thomas Cahill,$8.49,4.5,Paperback
1996,73,Neuromancer,William Gibson,$15.40,4.3,Paperback
1996,74,Envisioning Information,Edward R. Tufte,$21.59,4.5,Hardcover
1996,75,The Runaway Jury: A Novel,John Grisham,$8.01,4.4,Hardcover
1996,76,The Soul's Code: In Search of Character and Calling,James Hillman,$10.00,4.4,Hardcover
1996,77,"Mythical Man-Month, The: Essays on Software Engineering, Anniversary Edition",Frederick Brooks Jr.,$24.49,4.5,Paperback
1996,78,Desperation,Stephen King,$27.98,4.5,Hardcover
1996,79,The Ultimate Hitchhiker's Guide,Douglas Adams,$4.01,4.7,Hardcover
1996,80,The Deep End of the Ocean,Jacquelyn Mitchard,$16.45,4.2,Hardcover
1996,81,The Art of Kissing,William Cane,$2.00,3.9,Paperback
1996,82,Teach Yourself Java in 21 Days,Laura Lemay,$2.36,4.1,Paperback
1996,83,How to Set Up and Maintain a World Wide Web Site: The Guide for Information Providers,Lincoln Stein,$3.99,1.0,Hardcover
1996,84,Servant of the Bones: A novel,Anne Rice,$7.63,4.6,Hardcover
1996,85,Hidden Order: The Economics of Everyday Life,David D. Friedman,$29.76,3.6,Hardcover
1996,86,The One to One Future: Building Relationships One Customer at a Time,Don Peppers,$16.64,4.4,Hardcover
1996,87,Primary Colors: A Novel of Politics,"Anonymous,",$4.22,4.6,Hardcover
1996,88,Red Mars (Mars Trilogy),Kim Stanley Robinson,$36.47,4.2,Mass Market Paperback
1996,89,The Road Ahead: Completely Revised and Up-to-Date,Bill Gates,$6.10,4.0,Paperback
1996,90,Longitude: The True Story of a Lone Genius Who Solved the Greatest Scientific Problem of His Time,Dava Sobel,$3.89,4.4,Paperback
1996,91,Fluid Concepts And Creative Analogies: Computer Models Of The Fundamental Mechanisms Of Thought,Douglas R. Hofstadter,$27.01,4.5,Hardcover
1996,92,Learning Perl (Nutshell Handbooks),"Andy (editor) Schwartz, Randal L.; Oram",$8.39,4.8,Paperback
1996,93,NetMarketing,NetGuide,$9.93,5.0,Paperback
1996,94,Downsize This!,Michael Moore,$9.40,4.2,Hardcover
1996,95,Morgan Stanley the Internet Report,Mary Meeker,$23.99,5.0,Paperback
1996,96,The Structure of Scientific Revolutions,Thomas S. Kuhn,$2.94,4.6,Paperback
1996,97,Lean Thinking : Banish Waste and Create Wealth in Your Corporation,James P. Womack,$12.41,4.5,Hardcover
1996,98,Mind Hunter: Inside the FBI's Elite Serial Crime Unit,John Douglas,$2.00,4.6,Mass Market Paperback
1996,99,The Complete Book of Scriptwriting,J. Michael Straczynski,$20.30,4.5,Hardcover
1997,1,Cold Mountain: A Novel,Charles Frazier,$12.80,4.4,Hardcover
1997,2,Into Thin Air: A Personal Account of the Mount Everest Disaster,Jon Krakauer,$14.98,4.6,Hardcover
1997,3,The Perfect Storm: A True Story of Men Against the Sea,Sebastian Junger,$14.98,4.6,Hardcover
1997,4,Angela's Ashes (The Frank McCourt Memoirs),Frank McCourt,$12.08,4.4,Hardcover
1997,5,Creating Killer Web Sites: The Art of Third-Generation Site Design,David Siegel,$24.39,4.0,Paperback
1997,6,The Visual Display of Quantitative Information,Edward R. TUFTE,$19.69,4.4,Paperback
1997,7,Net Gain: Expanding Markets through Virtual Communities,John Hagel III,$10.97,4.0,Hardcover
1997,8,Don't Sweat the Small Stuff . . . and It's All Small Stuff: Simple Ways to Keep the Little Things from Taking Over Your Life (Don't Sweat the Small Stuff Series),Richard Carlson,$11.98,4.6,Paperback
1997,9,"Visual Explanations: Images and Quantities, Evidence and Narrative",Edward R. Tufte,$21.45,4.6,Hardcover
1997,10,Songs in Ordinary Time (Oprah's Book Club),Mary McGarry Morris,$4.21,4.0,Paperback
1997,11,The God of Small Things,Arundhati Roy,$11.00,4.2,Hardcover
1997,12,The Motley Fool Investment Guide: How the Fools Beat Wall Street's Wise Men and How You Can Too,Tom Gardner,$8.15,4.0,Paperback
1997,13,The Millionaire Next Door: The Surprising Secrets of America's Wealthy,Thomas J. Stanley,$11.74,4.6,Hardcover
1997,14,Crossing the Chasm: Marketing and Selling High-Tech Products to Mainstream Customers,Geoffrey A. Moore,$1.31,4.1,Paperback
1997,15,Stones from the River,Ursula Hegi,$9.21,4.3,Paperback
1997,16,Midnight in the Garden of Good and Evil,John Berendt,$14.32,4.4,Hardcover
1997,17,Against the Gods: The Remarkable Story of Risk,Peter L. Bernstein,$23.27,4.4,Hardcover
1997,18,How the Mind Works,Steven Pinker,$21.99,4.4,Hardcover
1997,19,Webonomics : Nine Essential Principles for Growing Your Business on the World Wide Web,Evan I. Schwartz,$3.25,4.6,Hardcover
1997,20,The 7 Habits of Highly Effective People,Stephen R. Covey,$8.00,4.6,Paperback
1997,21,Built to Last: Successful Habits of Visionary Companies,James C. Collins,$4.14,4.6,Paperback
1997,22,Design Patterns: Elements of Reusable Object-Oriented Software,Erich Gamma,$48.88,4.7,Hardcover
1997,23,Ellen Foster,Kaye Gibbons,$8.53,4.2,Paperback
1997,24,The All New All Purpose: Joy of Cooking,Irma S. Rombauer,$26.24,4.7,Hardcover
1997,25,Influence: The Psychology of Persuasion,Robert B. Cialdini,$30.48,4.6,Paperback
1997,26,Inside the Tornado: Marketing Strategies from Silicon Valley's Cutting Edge,Geoffrey A. Moore,$19.85,4.5,Hardcover
1997,27,Eight Weeks to Optimum Health,Andrew Weil M.D.,$7.93,4.5,Hardcover
1997,28,The Man Who Listens to Horses: The Story of a Real-Life Horse Whisperer,Monty Roberts,$12.99,4.8,Hardcover
1997,29,Mason & Dixon: A Novel,Thomas Pynchon,$3.45,4.4,Hardcover
1997,30,Underworld,Don DeLillo,$20.75,4.2,Hardcover
1997,31,The Partner: A Novel,John Grisham,$13.47,4.4,Hardcover
1997,32,Rapid Development: Taming Wild Software Schedules,Steve McConnell,$24.18,4.4,Paperback
1997,33,She's Come Undone,Wally Lamb,$9.00,4.4,Paperback
1997,34,A Lesson Before Dying (Oprah's Book Club),Ernest J. Gaines,$8.20,4.5,Paperback
1997,35,A Virtuous Woman (Oprah's Book Club),Kaye Gibbons,$4.99,3.9,Paperback
1997,36,Selling the Invisible: A Field Guide to Modern Marketing,Harry Beckwith,$12.86,4.5,Hardcover
1997,37,Programming Perl,Tom Christiansen,$7.90,3.9,Paperback
1997,38,The Royals,Kitty Kelley,$4.99,4.2,Hardcover
1997,39,"Guns, Germs and Steel: The Fates of Human Societies",Jared Diamond,$17.63,4.5,Hardcover
1997,40,The C++ Programming Language,Bjarne Stroustrup,$15.49,4.5,Paperback
1997,41,The Balanced Scorecard: Translating Strategy into Action,Robert S. Kaplan,$17.89,4.5,Hardcover
1997,42,What Will Be: How the World of Information Will Change Our Lives,Michael L. Dertouzos,$17.24,4.0,Hardcover
1997,43,Envisioning Information,Edward R. Tufte,$21.59,4.5,Hardcover
1997,44,Starship Troopers,Robert A. Heinlein,$1.95,4.5,Paperback
1997,45,NetSpy,NetGuide,$1.90,1.2,Paperback
1997,46,"JAVA IN A NUTSHELL, A DESKTOP QUICK REFERENCE",DAVID FLANAGAN,$7.00,3.8,Paperback
1997,47,The Merck Manual of Medical Information: Home Edition,Merck & Co.,$13.75,4.6,Hardcover
1997,48,What Works on Wall Street: A Guide to the Best-Performing Investment Strategies of All Time,James P. O'Shaughnessy (Author),$15.82,4.1,Hardcover
1997,49,Release 2.0,Esther Dyson,$1.74,3.9,Hardcover
1997,50,The Rapture of Canaan,Sheri Reynolds,$9.99,4.2,Paperback
1997,51,"CITIZEN SOLDIERS : The U.S. Army from the Normandy Beaches to the Bulge to the Surrender of Germany -- June 7, 1944-May 7, 1945",Stephen E. Ambrose,$16.71,4.7,Hardcover
1997,52,Intellectual Capital,Thomas A. Stewart,$16.78,5.0,Hardcover
1997,53,Enterprise One to One: Tools for Competing in the Interactive Age,Don Peppers,$9.99,3.7,Hardcover
1997,54,"CookWise: The Hows & Whys of Successful Cooking, The Secrets of Cooking Revealed",Shirley O. Corriher,$17.75,4.7,Hardcover
1997,55,The Angel of Darkness,Caleb Carr,$13.95,4.5,Hardcover
1997,56,"Conversations with God: An Uncommon Dialogue, Book 1",Neale Donald Walsch,$13.36,4.6,Hardcover
1997,57,The English Patient: Man Booker Prize Winner,Michael Ondaatje,$11.07,4.2,Paperback
1997,58,Enter The Zone: A Dietary Road map,Barry Sears,$14.19,4.4,Hardcover
1997,59,The Intelligent Investor: A Book of Practical Counsel,Benjamin Graham,$18.92,4.4,Hardcover
1997,60,The Dark Side of Camelot,Seymour M. Hersh,$10.45,4.5,Hardcover
1997,61,Client/Server Programming with Java and CORBA,Robert Orfali,$75.69,5.0,Paperback
1997,62,Unnatural Exposure,Patricia Cornwell,$9.99,4.5,Hardcover
1997,63,Naked,David Sedaris,$14.62,4.3,Hardcover
1997,64,"Undaunted Courage: Meriwether Lewis, Thomas Jefferson, and the Opening of the American West",Stephen Ambrose,$13.44,4.6,Paperback
1997,65,Simple Abundance: A Daybook of Comfort of Joy,Sarah Ban Breathnach,$14.98,4.6,Hardcover
1997,66,The Whole Shebang: A State-of-the-Universe(s) Report,Timothy Ferris,$10.95,4.6,Hardcover
1997,67,Real Time: Preparing for the Age of the Never Satistied Customer,Regis McKenna,$9.75,3.8,Hardcover
1997,68,Wizard and Glass (Dark Tower),Stephen King,$18.49,4.7,Paperback
1997,69,Snow Crash,Neal Stephenson,$3.21,4.3,Mass Market Paperback
1997,70,Leading Change,John P. Kotter,$8.97,4.6,Hardcover
1997,71,The Education of a Speculator,Victor Niederhoffer,$24.25,4.2,Hardcover
1997,72,"Plum Island (A John Corey Novel, 1)",Nelson DeMille,$15.00,4.4,Hardcover
1997,73,"Apple:: The Inside Story of Intrigue, Egomania, and Business Blunders",Jim Carlton,$2.07,4.3,Hardcover
1997,74,3001: The Final Odyssey,Arthur C. Clarke,$20.26,4.2,Hardcover
1997,75,MAN SEARCH FOR MEANING,Viktor E. Frankl,$27.59,4.7,Mass Market Paperback
1997,76,Personal History,Katharine Graham,$30.00,4.4,Hardcover
1997,77,The Heart of a Woman,Maya Angelou,$6.62,4.7,Paperback
1997,78,The Goal: A Process of Ongoing Improvement,Eliyahu M. Goldratt,$14.76,4.6,Paperback
1997,79,"The Bankers: The Next Generation The New Worlds of Money, Credit and Banking in an Electronic Age",Martin Mayer,$15.96,4.3,Hardcover
1997,80,Code Complete,Steve McConnell,$18.78,4.2,Paperback
1997,81,Only the Paranoid Survive,Andrew S. Grove,$32.95,4.4,Hardcover
1997,82,The Bible Code,Michael Drosnin,$10.31,4.3,Hardcover
1997,83,About Face: The Essentials of User Interface Design,Alan Cooper,$21.00,2.9,Paperback
1997,84,Designing Web Graphics 2,Lynda Weinman,$2.84,2.4,Paperback
1997,85,Into the Wild,Jon Krakauer,$8.37,4.4,Paperback
1997,86,A Certain Justice (Adam Dalgliesh Mystery Series #10),P. D. James,$12.00,4.3,Hardcover
1997,87,Being Digital,Nicholas Negroponte,$7.35,4.4,Paperback
1997,88,American Sphinx: The Character of Thomas Jefferson,Joseph J. Ellis,$22.57,4.4,Hardcover
