year,rank,title,author,price,rating,format
2009,83,The Lacuna: A Novel,Barbara Kingsolver,$17.92,4.4,Hardcover
2009,84,Crucial Conversations: Tools for Talking When Stakes are High,Kerry Patterson,$17.75,4.5,Paperback
2009,85,Half the Sky: Turning Oppression into Opportunity for Women Worldwide,Nicholas D. Kristof,$9.63,4.6,Hardcover
2009,86,The Associate,John Grisham,$9.30,4.4,Hardcover
2009,87,Artisan Bread in Five Minutes a Day: The Discovery That Revolutionizes Home Baking,Jeff Hertzberg,$9.68,4.7,Hardcover
2009,88,Three Cups of Tea: One Man's Journey to Change the World... One Child at a Time (Young Reader's Edition),Sarah Thomson,$9.99,4.4,Paperback
2009,89,Pursuit of Honor,Vince Flynn,$9.00,4.6,Hardcover
2009,90,What the Dog Saw: And Other Adventures,Malcolm Gladwell,$19.14,4.4,Hardcover
2009,91,The Last Song,Nicholas Sparks,$13.83,4.6,Hardcover
2009,92,Atlas Shrugged,Ayn Rand,$12.93,4.5,Paperback
2009,93,The White Tiger: A Novel,Aravind Adiga,$10.66,4.2,Paperback
2009,94,"Now, Discover Your Strengths: The revolutionary Gallup program that shows you how to develop your unique talents and strengths",Gallup,$14.85,3.6,Hardcover
2009,95,"Same Kind of Different As Me: A Modern-Day Slave, an International Art Dealer, and the Unlikely Woman Who Bound Them Together",Ron Hall,$9.32,4.6,Paperback
2009,96,U is for Undertow: A Kinsey Millhone Novel,Sue Grafton,$9.98,4.5,Hardcover
2009,97,Catching Fire (The Hunger Games),Suzanne Collins,$10.11,4.7,Hardcover
2010,1,The Girl Who Kicked the Hornet's Nest (Millennium Trilogy),Stieg Larsson,$5.99,4.6,Hardcover
2010,2,The Girl with the Dragon Tattoo (The Girl with the Dragon Tattoo Series),Stieg Larsson,$17.67,4.5,Paperback
2010,3,Decision Points,George W. Bush,$8.98,4.6,Hardcover
2010,4,The Help,Kathryn Stockett,$15.50,4.8,Hardcover
2010,5,The Girl Who Played with Fire: A Lisbeth Salander Novel (The Girl with the Dragon Tattoo Series),Stieg Larsson,$8.31,4.6,Paperback
2010,6,"The Ugly Truth (Diary of a Wimpy Kid, Book 5)",Jeff Kinney,$7.57,4.7,Hardcover
2010,7,StrengthsFinder 2.0,Gallup,$23.99,4.1,Hardcover
2010,8,Mockingjay (The Hunger Games),Suzanne Collins,$15.93,4.6,Hardcover
2010,9,Women Food and God: An Unexpected Path to Almost Everything,Geneen Roth,$9.56,4.4,Hardcover
2010,10,"Autobiography of Mark Twain: The Complete and Authoritative Edition, Vol. 1",Mark Twain,$16.52,4.4,Hardcover
2010,11,The Big Short: Inside the Doomsday Machine,Michael Lewis,$12.47,4.6,Hardcover
2010,12,Food Rules: An Eater's Manual,Michael Pollan,$8.04,4.4,Paperback
2010,13,"Unbroken: A World War II Story of Survival, Resilience, and Redemption",Laura Hillenbrand,$10.97,4.7,Hardcover
2010,14,"Dead in the Family (Sookie Stackhouse/True Blood, Book 10)",Charlaine Harris,$8.08,4.5,Hardcover
2010,15,Sh*t My Dad Says,Justin Halpern,$3.01,4.5,Hardcover
2010,16,Crazy Love: Overwhelmed by a Relentless God,Francis Chan,$12.17,4.7,Paperback
2010,17,The Short Second Life of Bree Tanner: An Eclipse Novella (The Twilight Saga),Stephenie Meyer,$11.61,4.7,Hardcover
2010,18,Life,Keith Richards,$19.08,4.5,Hardcover
2010,19,Cutting for Stone,Abraham Verghese,$9.19,4.7,Paperback
2010,20,The Daily Show with Jon Stewart Presents Earth (The Book): A Visitor's Guide to the Human Race,Jon Stewart,$12.97,4.5,Hardcover
2010,21,The Official SAT Study Guide,The College Board,$37.00,4.4,Paperback
2010,22,"Game Change: Obama and the Clintons, McCain and Palin, and the Race of a Lifetime",John Heilemann,$8.99,4.5,Hardcover
2010,23,The Immortal Life of Henrietta Lacks,Rebecca Skloot,$13.13,4.7,Hardcover
2010,24,"The Lost Hero (Heroes of Olympus, Book 1)",Rick Riordan,$9.29,4.7,Hardcover
2010,25,Teach Like a Champion: 49 Techniques that Put Students on the Path to College,Doug Lemov,$18.99,4.5,Paperback
2010,26,Outliers: The Story of Success,Malcolm Gladwell,$12.26,4.6,Hardcover
2010,27,Catching Fire (The Hunger Games),Suzanne Collins,$10.11,4.7,Hardcover
2010,28,"The Five Dysfunctions of a Team: A Leadership Fable, 20th Anniversary Edition",Patrick M. Lencioni,$9.74,4.6,Hardcover
2010,29,"Good to Great: Why Some Companies Make the Leap...And Others Don't (Good to Great, 1)",Jim Collins,$10.64,4.5,Hardcover
2010,30,Three Cups of Tea: One Man's Mission to Promote Peace - One School at a Time,Greg Mortenson,$5.97,4.3,Paperback
2010,31,"The Road to Serfdom: Text and Documents--The Definitive Edition (The Collected Works of F. A. Hayek, Volume 2)",F. A. Hayek,$11.10,4.7,Paperback
2010,32,The Confession: A Novel,John Grisham,$10.99,4.4,Hardcover
2010,33,"Delivering Happiness: A Path to Profits, Passion, and Purpose",Tony Hsieh,$6.22,4.6,Hardcover
2010,34,A Patriot's History of the United States: From Columbus's Great Discovery to the War on Terror,Larry Schweikart,$20.99,4.7,Paperback
2010,35,"The Last Olympian (Percy Jackson and the Olympians, Book 5)",Rick Riordan,$10.10,4.8,Hardcover
2010,36,Switch: How to Change Things When Change Is Hard,Chip Heath,$12.89,4.6,Hardcover
2010,37,The Art of Racing in the Rain: A Novel,Garth Stein,$8.83,4.6,Paperback
2010,38,The 5 Love Languages: The Secret to Love That Lasts,Gary Chapman,$3.79,4.7,Paperback
2010,39,"Broke: The Plan to Restore Our Trust, Truth and Treasure",Glenn Beck,$8.00,4.4,Hardcover
2010,40,Drive: The Surprising Truth About What Motivates Us,Daniel H. Pink,$10.87,4.5,Hardcover
2010,41,"The Red Pyramid (The Kane Chronicles, Book 1)",Rick Riordan,$8.39,4.7,Hardcover
2010,42,Percy Jackson and the Olympians Paperback Boxed Set (Books 1-3),Rick Riordan,$3.55,4.8,Paperback
2010,43,Little Bee: A Novel,Chris Cleave,$7.00,4.2,Paperback
2010,44,"Barefoot Contessa, How Easy Is That?: Fabulous Recipes & Easy Tips",Ina Garten,$14.40,4.7,Hardcover
2010,45,George Washington's Sacred Fire,Peter A. Lillback,$13.00,4.6,Paperback
2010,46,Radical: Taking Back Your Faith from the American Dream,David Platt,$8.16,4.7,Paperback
2010,47,"Towers of Midnight (Wheel of Time, Book Thirteen)",Robert Jordan,$21.92,4.8,Hardcover
2010,48,Sarah's Key: A Novel,Tatiana de Rosnay,$12.91,4.5,Paperback
2010,49,The Hunger Games,Suzanne Collins,$16.56,4.7,Hardcover
2010,50,The 7 Habits of Highly Effective People: Powerful Lessons in Personal Change,Stephen R. Covey,$17.18,4.6,Paperback
2010,51,Cleopatra: A Life,Stacy Schiff,$8.00,4.2,Hardcover
2010,52,Freedom: A Novel,Jonathan Franzen,$14.31,4.2,Hardcover
2010,53,Freedom,Jonathan Franzen,$8.99,4.2,Hardcover
2010,54,"Born to Run: A Hidden Tribe, Superathletes, and the Greatest Race the World Has Never Seen",Christopher McDougall,$8.48,4.7,Hardcover
2010,55,Fall of Giants (The Century Trilogy),Ken Follett,$13.94,4.4,Hardcover
2010,56,"Eat, Pray, Love: One Woman's Search for Everything Across Italy, India and Indonesia",Elizabeth Gilbert,$2.99,4.4,Paperback
2010,57,"Eat Pray Love: One Woman's Search for Everything Across Italy, India and Indonesia",Elizabeth Gilbert,$6.39,4.4,Paperback
2010,58,Tao I: The Way of All Life,Zhi Gang Sha Dr.,$12.00,4.4,Hardcover
2010,59,The Checklist Manifesto: How to Get Things Right,Atul Gawande,$14.36,4.5,Hardcover
2010,60,Chelsea Chelsea Bang Bang,Chelsea Handler,$9.49,4.4,Hardcover
2010,61,Let the Great World Spin: A Novel,Colum McCann,$9.99,4.3,Paperback
2010,62,The Pioneer Woman Cooks: Recipes from an Accidental Country Girl,Ree Drummond,$16.43,4.8,Hardcover
2010,63,The Tipping Point: How Little Things Can Make a Big Difference,Malcolm Gladwell,$9.33,4.4,Paperback
2010,64,The Omnivore's Dilemma: A Natural History of Four Meals,Michael Pollan,$9.97,4.6,Paperback
2010,65,The Belly Fat Cure: Discover the New Carb Swap System and Lose 4 to 9 Lbs. Every Week,Jorge Cruise,$15.56,4.1,Spiral-bound
2010,66,"The Battle of the Labyrinth (Percy Jackson and the Olympians, Book 4)",Rick Riordan,$7.77,4.8,Paperback
2010,67,"The 4-Hour Workweek: Escape 9-5, Live Anywhere, and Join the New Rich",Timothy Ferriss,$11.97,4.5,Hardcover
2010,68,"Full Dark, No Stars",Stephen King,$16.53,4.6,Hardcover
2010,69,Sizzling Sixteen (Stephanie Plum Novels),Janet Evanovich,$4.45,4.5,Hardcover
2010,70,The Grand Design,Stephen Hawking,$13.12,4.5,Hardcover
2010,71,The Overton Window,Glenn Beck,$3.00,4.5,Hardcover
2010,72,"Jesus Calling, Padded Hardcover, with Scripture References: Enjoying Peace in His Presence (A 365-Day Devotional)",Sarah Young,$9.09,4.9,Hardcover
2010,73,Spoken from the Heart,Laura Bush,$9.70,4.6,Hardcover
2010,74,Diary of a Wimpy Kid Do-it-yourself Book,Jeff Kinney,$24.96,4.7,Hardcover
2010,75,The Book of Awakening: Having the Life You Want by Being Present to the Life You Have,Mark Nepo,$16.96,4.7,Paperback
2010,76,"Mastering the Art of French Cooking, Volume I: 50th Anniversary Edition: A Cookbook",Julia Child,$26.49,4.8,Hardcover
2010,77,Safe Haven,Nicholas Sparks,$8.07,4.6,Hardcover
2010,78,"Change Your Brain, Change Your Body: Use Your Brain to Get and Keep the Body You Have Always Wanted",Daniel G. Amen,$10.43,4.4,Hardcover
2010,79,"The Kind Diet: A Simple Guide to Feeling Great, Losing Weight, and Saving the Planet",Alicia Silverstone,$16.00,4.5,Hardcover
2010,80,Decoded,Jay-Z,$19.28,4.7,Hardcover
2010,81,The Glass Castle: A Memoir (book),Jeannette Walls,$9.99,4.6,Paperback
2010,82,The Shack: Where Tragedy Confronts Eternity,William P. Young,$4.63,4.6,Paperback
2010,83,"Breaking Dawn (The Twilight Saga, Book 4)",Stephenie Meyer,$14.97,4.7,Hardcover
2010,84,The Sookie Stackhouse Novels (Sookie Stackhouse / Southern Vampire),Charlaine Harris,$51.89,4.7,Paperback
2010,85,The Guernsey Literary and Potato Peel Pie Society,Mary Ann Shaffer,$9.82,4.6,Paperback
2010,86,Hotel on the Corner of Bitter and Sweet,Jamie Ford,$9.99,4.5,Paperback
2010,87,"The 4-Hour Body: An Uncommon Guide to Rapid Fat-Loss, Incredible Sex, and Becoming Superhuman",Timothy Ferriss,$16.45,4.4,Hardcover
2010,88,Crucial Conversations: Tools for Talking When Stakes are High,Kerry Patterson,$17.75,4.5,Paperback
2010,89,"Happy Ever After (Bride Quartet, Book 4)",Nora Roberts,$13.12,4.7,Paperback
2010,90,A Guide to the Project Management Body of Knowledge,Project Management Institute,$8.08,4.5,Paperback
2010,91,"Savor the Moment (The Bride Quartet, Book 3)",Nora Roberts,$15.52,4.6,Paperback
2010,92,The Book Thief,Markus Zusak,$8.24,4.6,Paperback
2010,93,The Catcher in the Rye,J. D. Salinger,$7.03,4.4,Paperback
2010,94,"The China Study: The Most Comprehensive Study of Nutrition Ever Conducted And the Startling Implications for Diet, Weight Loss, And Long-term Health",Thomas Campbell,$7.90,4.7,Paperback
2010,95,American Assassin: A Thriller (A Mitch Rapp Novel),Vince Flynn,$14.31,4.5,Hardcover
2010,96,Rework,Jason Fried,$10.56,4.5,Hardcover
2010,97,In Defense of Food: An Eater's Manifesto,Michael Pollan,$9.99,4.6,Paperback
2010,98,Squirrel Seeks Chipmunk: A Modest Bestiary,David Sedaris,$5.47,4.2,Hardcover
2010,99,Who Moved My Cheese?: An A-Mazing Way to Deal with Change in Your Work and in Your Life,Spencer Johnson,$6.40,4.6,Hardcover
2011,1,Steve Jobs,Walter Isaacson,$15.44,4.7,Hardcover
2011,2,Heaven is for Real: A Little Boy's Astounding Story of His Trip to Heaven and Back,Todd Burpo,$5.30,4.6,Paperback
2011,3,"Cabin Fever (Diary of a Wimpy Kid, Book 6)",Jeff Kinney,$3.56,4.7,Hardcover
2011,4,StrengthsFinder 2.0,Gallup,$23.99,4.1,Hardcover
2011,5,The Hunger Games (Book 1),Suzanne Collins,$3.47,4.7,Paperback
2011,6,"Unbroken: A World War II Story of Survival, Resilience, and Redemption",Laura Hillenbrand,$10.97,4.7,Hardcover
2011,7,Inheritance: Book IV (Inheritance Cycle),Christopher Paolini,$13.55,4.7,Hardcover
2011,8,Go the Fuck to Sleep (Go the F to Sleep),Adam Mansbach,$14.83,4.8,Hardcover
2011,9,Mockingjay (The Hunger Games),Suzanne Collins,$15.93,4.6,Hardcover
2011,10,Game of Thrones Boxed Set: A Game of Thrones/A Clash of Kings/A Storm of Swords/A Feast for Crows,George R.R. Martin,$31.93,4.7,Mass Market Paperback
2011,11,Catching Fire (The Hunger Games),Suzanne Collins,$10.11,4.7,Hardcover
2011,12,The 17 Day Diet: A Doctor's Plan Designed for Rapid Results,Mike Moreno,$9.04,4.3,Hardcover
2011,13,A Dance with Dragons (A Song of Ice and Fire),George R. R. Martin,$17.51,4.6,Hardcover
2011,14,"The Son of Neptune (Heroes of Olympus, Book 2)",Rick Riordan,$11.34,4.8,Hardcover
2011,15,Killing Lincoln: The Shocking Assassination that Changed America Forever (Bill O'Reilly's Killing Series),Bill O'Reilly,$11.37,4.6,Hardcover
2011,16,The Help,Kathryn Stockett,$11.48,4.8,Paperback
2011,17,The Immortal Life of Henrietta Lacks,Rebecca Skloot,$10.44,4.7,Paperback
2011,18,11/22/63: A Novel,Stephen King,$20.88,4.8,Hardcover
2011,19,The Official SAT Study Guide,The College Board,$37.00,4.4,Paperback
2011,20,"Jesus Calling, Padded Hardcover, with Scripture References: Enjoying Peace in His Presence (A 365-Day Devotional)",Sarah Young,$9.09,4.9,Hardcover
2011,21,The Hunger Games Trilogy Boxed Set,Suzanne Collins,$16.00,4.8,Hardcover
2011,22,Cutting for Stone,Abraham Verghese,$9.19,4.7,Paperback
2011,23,Tina Fey: Bossypants,Tina Fey,$6.90,4.3,Hardcover
2011,24,"The 4-Hour Body: An Uncommon Guide to Rapid Fat-Loss, Incredible Sex, and Becoming Superhuman",Timothy Ferriss,$16.45,4.4,Hardcover
2011,25,"In the Garden of Beasts: Love, Terror, and an American Family in Hitler's Berlin",Erik Larson,$11.31,4.3,Hardcover
2011,26,The 5 Love Languages: The Secret to Love That Lasts,Gary Chapman,$3.79,4.7,Paperback
2011,27,Crazy Love: Overwhelmed by a Relentless God,Francis Chan,$12.17,4.7,Paperback
2011,28,A Stolen Life: A Memoir,Jaycee Dugard,$15.89,4.5,Hardcover
2011,29,The Girl Who Kicked the Hornet's Nest (Millennium Trilogy),Stieg Larsson,$5.99,4.6,Hardcover
2011,30,Water for Elephants: A Novel,Sara Gruen,$8.55,4.6,Paperback
2011,31,"The Five Dysfunctions of a Team: A Leadership Fable, 20th Anniversary Edition",Patrick M. Lencioni,$9.74,4.6,Hardcover
2011,32,The Lego Ideas Book: Unlock Your Imagination,Daniel Lipkowitz,$12.44,4.5,Hardcover
2011,33,One Thousand Gifts: A Dare to Live Fully Right Where You Are,Ann Voskamp,$17.76,4.6,Hardcover
2011,34,The 7 Habits of Highly Effective People: Powerful Lessons in Personal Change,Stephen R. Covey,$17.18,4.6,Paperback
2011,35,"The Dukan Diet: 2 Steps to Lose the Weight, 2 Steps to Keep It Off Forever",Pierre Dukan,$11.81,4.2,Hardcover
2011,36,"The Throne of Fire (The Kane Chronicles, Book 2)",Rick Riordan,$13.52,4.7,Hardcover
2011,37,"Dead Reckoning (Sookie Stackhouse/True Blood, Book 11)",Charlaine Harris,$4.54,4.5,Hardcover
2011,38,"Good to Great: Why Some Companies Make the Leap...And Others Don't (Good to Great, 1)",Jim Collins,$10.64,4.5,Hardcover
2011,39,The Litigators,John Grisham,$13.62,4.4,Hardcover
2011,40,"Love Wins: A Book About Heaven, Hell, and the Fate of Every Person Who Ever Lived",Rob Bell,$15.45,4.4,Hardcover
2011,41,The Help,Kathryn Stockett,$10.43,4.8,Paperback
2011,42,"Thinking, Fast and Slow",Daniel Kahneman,$20.73,4.6,Hardcover
2011,43,The Paris Wife: A Novel,Paula McLain,$13.98,4.3,Hardcover
2011,44,Radical: Taking Back Your Faith from the American Dream,David Platt,$8.16,4.7,Paperback
2011,45,The Art of Racing in the Rain: A Novel,Garth Stein,$8.83,4.6,Paperback
2011,46,Teach Like a Champion: 49 Techniques that Put Students on the Path to College,Doug Lemov,$18.99,4.5,Paperback
2011,47,"Eat to Live: The Amazing Nutrient-Rich Program for Fast and Sustained Weight Loss, Revised Edition",Joel Fuhrman MD,$8.87,4.5,Paperback
2011,48,"The China Study: The Most Comprehensive Study of Nutrition Ever Conducted And the Startling Implications for Diet, Weight Loss, And Long-term Health",Thomas Campbell,$7.90,4.7,Paperback
2011,49,What to Expect When You're Expecting,Heidi Eisenberg Murkoff,$1.20,4.5,Paperback
2011,50,The Best of Me,Nicholas Sparks,$8.21,4.6,Hardcover
2011,51,Jacqueline Kennedy: Historic Conversations on Life with John F. Kennedy,Jacqueline Kennedy,$18.19,4.4,Hardcover
2011,52,The Girl with the Dragon Tattoo (The Girl with the Dragon Tattoo Series),Stieg Larsson,$17.67,4.5,Paperback
2011,53,The Greater Journey: Americans in Paris,David McCullough,$10.99,4.5,Hardcover
2011,54,Switch: How to Change Things When Change Is Hard,Chip Heath,$12.89,4.6,Hardcover
2011,55,Every Thing On It,Shel Silverstein,$13.84,4.9,Hardcover
2011,56,Miss Peregrine's Home for Peculiar Children (Miss Peregrine's Peculiar Children),Ransom Riggs,$13.93,4.3,Hardcover
2011,57,Moonwalking With Einstein: The Art and Science of Remembering Everything,Joshua Foer,$8.59,4.5,Hardcover
2011,58,The Great Gatsby: The Only Authorized Edition,F. Scott Fitzgerald,$8.39,4.4,Paperback
2011,59,The Help,Kathryn Stockett,$15.50,4.8,Hardcover
2011,60,1Q84: A novel,Haruki Murakami,$45.45,4.4,Hardcover
2011,61,Boomerang: Travels in the New Third World,Michael Lewis,$12.99,4.4,Hardcover
2011,62,Who Moved My Cheese?: An A-Mazing Way to Deal with Change in Your Work and in Your Life,Spencer Johnson,$6.40,4.6,Hardcover
2011,63,"Strengths Based Leadership: Great Leaders, Teams, and Why People Follow",Gallup,$17.85,4.5,Hardcover
2011,64,Elder Scrolls V: Skyrim: Prima Official Game Guide,David Hodgson,$10.85,4.6,Paperback
2011,65,The Glass Castle: A Memoir (book),Jeannette Walls,$9.99,4.6,Paperback
2011,66,The Book Thief,Markus Zusak,$8.24,4.6,Paperback
2011,67,"The 4-Hour Workweek: Escape 9-5, Live Anywhere, and Join the New Rich",Timothy Ferriss,$11.97,4.5,Hardcover
2011,68,"Oh, the Places You'll Go!",Dr. Seuss,$8.48,4.9,Hardcover
2011,69,Through My Eyes,Tim Tebow,$8.29,4.7,Hardcover
2011,70,The Land of Painted Caves: A Novel (Earth's Children),Jean M. Auel,$20.87,4.2,Hardcover
2011,71,"The Social Animal: The Hidden Sources of Love, Character, and Achievement",David Brooks,$18.00,4.4,Hardcover
2011,72,A Guide to the Project Management Body of Knowledge,Project Management Institute,$8.08,4.5,Paperback
2011,73,Guinness World Records 2012,Guinness World Records,$10.50,4.6,Hardcover
2011,74,State of Wonder,Ann Patchett,$17.56,4.4,Hardcover
2011,75,A Visit from the Goon Squad: Pulitzer Prize Winner,Jennifer Egan,$9.54,4.0,Paperback
2011,76,"Prevent and Reverse Heart Disease: The Revolutionary, Scientifically Proven, Nutrition-Based Cure",Caldwell B. Esselstyn Jr.,$11.69,4.6,Paperback
2011,77,Harry Potter Paperback Box Set (Books 1-7),J. K. Rowling,$52.62,4.9,Paperback
2011,78,Explosive Eighteen: A Stephanie Plum Novel (Stephanie Plum Novels),Janet Evanovich,$8.00,4.5,Hardcover
2011,79,The 7 Habits of Highly Effective Teens: The Ultimate Teenage Success Guide,Sean Covey,$4.47,4.6,Paperback
2011,80,"Delivering Happiness: A Path to Profits, Passion, and Purpose",Tony Hsieh,$6.22,4.6,Hardcover
2011,81,"The Lost Hero (Heroes of Olympus, Book 1)",Rick Riordan,$9.29,4.7,Hardcover
2011,82,Room: A Novel,Emma Donoghue,$8.99,4.3,Paperback
2011,83,Hotel on the Corner of Bitter and Sweet,Jamie Ford,$9.99,4.5,Paperback
2011,84,The Tipping Point: How Little Things Can Make a Big Difference,Malcolm Gladwell,$9.33,4.4,Paperback
2011,85,Emotional Intelligence 2.0,Jean Greaves,$14.98,4.5,Hardcover
2011,86,Outliers: The Story of Success,Malcolm Gladwell,$10.45,4.6,Paperback
2011,87,Forks Over Knives: The Plant-Based Way to Health,Gene Stone,$12.10,4.5,Paperback
2011,88,The Girl Who Played with Fire: A Lisbeth Salander Novel (The Girl with the Dragon Tattoo Series),Stieg Larsson,$8.31,4.6,Paperback
2011,89,"Hungry Girl 300 Under 300: 300 Breakfast, Lunch & Dinner Dishes Under 300 Calories",Lisa Lillien,$14.39,4.4,Paperback
2011,90,The Alchemist,Paulo Coelho,$14.94,4.7,Paperback
2011,91,Getting Things Done: The Art of Stress-Free Productivity,David Allen,$13.11,4.4,Paperback
2011,92,The Invention of Hugo Cabret,Brian Selznick,$14.47,4.8,Hardcover
2011,93,"Now, Discover Your Strengths: The revolutionary Gallup program that shows you how to develop your unique talents and strengths",Gallup,$14.85,3.6,Hardcover
2011,94,Drive: The Surprising Truth About What Motivates Us,Daniel H. Pink,$9.99,4.5,Paperback
2011,95,Smokin' Seventeen (Stephanie Plum),Janet Evanovich,$6.79,4.5,Hardcover
2011,96,N/A,N/A,$22.49,4.8,N/A
2011,97,The Big Short: Inside the Doomsday Machine,Michael Lewis,$8.43,4.6,Paperback
2011,98,"Born to Run: A Hidden Tribe, Superathletes, and the Greatest Race the World Has Never Seen",Christopher McDougall,$9.96,4.7,Paperback
2011,99,The Official Guide for GMAT Review,GMAC (Graduate Management Admission Council),$8.97,4.4,Paperback
2012,1,"Fifty Shades Of Grey: Book One of the Fifty Shades Trilogy (Fifty Shades of Grey Series, 1)",E L James,$7.49,4.2,Paperback
2012,2,Fifty Shades Darker,E. L. James,$5.64,4.5,Paperback
2012,3,"Fifty Shades Freed: Book Three of the Fifty Shades Trilogy (Fifty Shades of Grey Series) (English Edition) (Fifty Shades of Grey Series, 3)",E L James,$7.16,4.5,Paperback
2012,4,The Hunger Games (Book 1),Suzanne Collins,$3.47,4.7,Paperback
2012,5,StrengthsFinder 2.0,Gallup,$23.99,4.1,Hardcover
2012,6,Fifty Shades Trilogy (Fifty Shades of Grey / Fifty Shades Darker / Fifty Shades Freed),E L James,$20.49,4.6,Paperback
2012,7,Catching Fire (The Hunger Games),Suzanne Collins,$10.11,4.7,Hardcover
2012,8,Mockingjay (The Hunger Games),Suzanne Collins,$15.93,4.6,Hardcover
2012,9,"The Third Wheel (Diary of a Wimpy Kid, Book 7)",Jeff Kinney,$6.32,4.6,Hardcover
2012,10,No Easy Day: The Autobiography of a Navy Seal: The Firsthand Account of the Mission That Killed Osama Bin Laden,Mark Owen,$17.11,4.6,Hardcover
2012,11,The Hunger Games Trilogy Boxed Set,Suzanne Collins,$16.00,4.8,Hardcover
2012,12,Gone Girl,Gillian Flynn,$12.01,4.1,Hardcover
2012,13,"The Mark of Athena (Heroes of Olympus, Book 3)",Rick Riordan,$11.56,4.8,Hardcover
2012,14,The Official SAT Study Guide,The College Board,$37.00,4.4,Paperback
2012,15,Game of Thrones Boxed Set: A Game of Thrones/A Clash of Kings/A Storm of Swords/A Feast for Crows,George R.R. Martin,$31.93,4.7,Mass Market Paperback
2012,16,Killing Kennedy: The End of Camelot (Bill O'Reilly's Killing Series),Bill O'Reilly,$15.44,4.6,Hardcover
2012,17,Killing Lincoln: The Shocking Assassination that Changed America Forever (Bill O'Reilly's Killing Series),Bill O'Reilly,$11.37,4.6,Hardcover
2012,18,"Unbroken: A World War II Story of Survival, Resilience, and Redemption",Laura Hillenbrand,$10.97,4.7,Hardcover
2012,19,Proof of Heaven: A Neurosurgeon's Journey into the Afterlife,Eben Alexander,$10.44,4.4,Paperback
2012,20,The 5 Love Languages: The Secret to Love That Lasts,Gary Chapman,$3.79,4.7,Paperback
2012,21,Barefoot Contessa Foolproof: Recipes You Can Trust: A Cookbook,Ina Garten,$13.66,4.8,Hardcover
2012,22,"Thinking, Fast and Slow",Daniel Kahneman,$20.73,4.6,Hardcover
2012,23,The Casual Vacancy,J.K. Rowling,$9.03,3.6,Hardcover
2012,24,The Harbinger: The Ancient Mystery That Holds the Secret of America's Future,Jonathan Cahn,$15.43,4.7,Paperback
2012,25,The Power of Habit: Why We Do What We Do in Life and Business,Charles Duhigg,$14.59,4.6,Hardcover
2012,26,Steve Jobs,Walter Isaacson,$15.44,4.7,Hardcover
2012,27,"Wheat Belly: Lose the Wheat, Lose the Weight, and Find Your Path Back to Health",William Davis,$12.95,4.4,Hardcover
2012,28,"Oh, the Places You'll Go!",Dr. Seuss,$8.48,4.9,Hardcover
2012,29,The 7 Habits of Highly Effective People: Powerful Lessons in Personal Change,Stephen R. Covey,$17.18,4.6,Paperback
2012,30,"The Five Dysfunctions of a Team: A Leadership Fable, 20th Anniversary Edition",Patrick M. Lencioni,$9.74,4.6,Hardcover
2012,31,Quiet: The Power of Introverts in a World That Can't Stop Talking,Susan Cain,$8.73,4.5,Hardcover
2012,32,The Great Gatsby: The Only Authorized Edition,F. Scott Fitzgerald,$8.39,4.4,Paperback
2012,33,The Racketeer,John Grisham,$16.98,4.3,Hardcover
2012,34,"The Blood Sugar Solution: The UltraHealthy Program for Losing Weight, Preventing Disease, and Feeling Great Now! (The Dr. Mark Hyman Library, 1)",Mark Hyman M.D.,$16.68,4.3,Hardcover
2012,35,"Goodnight, Goodnight, Construction Site",Sherri Duskey Rinker,$9.86,4.9,Hardcover
2012,36,The Immortal Life of Henrietta Lacks,Rebecca Skloot,$10.44,4.7,Paperback
2012,37,The Fault in Our Stars,John Green,$4.75,4.6,Hardcover
2012,38,"The Serpent's Shadow (The Kane Chronicles, Book 3)",Rick Riordan,$9.50,4.8,Hardcover
2012,39,One Thousand Gifts: A Dare to Live Fully Right Where You Are,Ann Voskamp,$17.76,4.6,Hardcover
2012,40,Wild: From Lost to Found on the Pacific Crest Trail,Cheryl Strayed,$13.51,4.4,Hardcover
2012,41,Winter of the World: Book Two of the Century Trilogy,Ken Follett,$13.88,4.5,Hardcover
2012,42,The Pioneer Woman Cooks―Food from My Frontier,Ree Drummond,$9.31,4.8,Hardcover
2012,43,The Lego Ideas Book: Unlock Your Imagination,Daniel Lipkowitz,$12.44,4.5,Hardcover
2012,44,Heaven is for Real: A Little Boy's Astounding Story of His Trip to Heaven and Back,Todd Burpo,$5.30,4.6,Paperback
2012,45,"Jesus Calling, Padded Hardcover, with Scripture References: Enjoying Peace in His Presence (A 365-Day Devotional)",Sarah Young,$9.09,4.9,Hardcover
2012,46,"Eat to Live: The Amazing Nutrient-Rich Program for Fast and Sustained Weight Loss, Revised Edition",Joel Fuhrman MD,$8.87,4.5,Paperback
2012,47,Thomas Jefferson: The Art of Power,Jon Meacham,$16.80,4.5,Hardcover
2012,48,"Good to Great: Why Some Companies Make the Leap...And Others Don't (Good to Great, 1)",Jim Collins,$10.64,4.5,Hardcover
2012,49,The Amateur,Edward Klein,$7.96,4.4,Hardcover
2012,50,The Smitten Kitchen Cookbook: Recipes and Wisdom from an Obsessive Home Cook,Deb Perelman,$14.92,4.6,Hardcover
2012,51,What to Expect When You're Expecting,Heidi Eisenberg Murkoff,$20.95,4.5,Paperback
2012,52,The Walking Dead: Compendium One,Robert Kirkman,$59.99,4.8,Paperback
2012,53,The Signal and the Noise: Why So Many Predictions Fail-But Some Don't,Nate Silver,$10.68,4.4,Hardcover
2012,54,How to Tell If Your Cat Is Plotting to Kill You (The Oatmeal) (Volume 2),The Oatmeal,$9.20,4.5,Paperback
2012,55,A Dance with Dragons (A Song of Ice and Fire),George R. R. Martin,$17.51,4.6,Hardcover
2012,56,America Again: Re-becoming the Greatness We Never Weren't,Stephen Colbert,$3.60,4.3,Hardcover
2012,57,LEGO NINJAGO: Character Encyclopedia,DK,$4.19,4.4,Hardcover
